"Type","KeyCite Treatment","KeyCite URL","Title","Document URL","Court Line","Filed Date","Citation","Cite Caveat","Parallel Cite","Docket Num","Summary",
"Cases","","","Janvey v. Alguire","https://www.westlaw.com/Document/I55950150e8fc11e692ccd0392c3f85a3/View/FullText.html?listSource=Search&list=CASE&rank=712&sessionScopeId=0066e1cf23c3ad09864e12e5e17a6d395f5650c427ebc0abee68fb245346c742&originationContext=Search%20Result&transitionType=SearchItem&contextData=%28sc.Default%29&VR=3.0&RS=cblt1.0","United States Court of Appeals, Fifth Circuit.","January 31, 2017","847 F.3d 231","","2017 WL 430078","14-10857, 14-10945, 14-11014, 14-11093","LITIGATION  Alternative Dispute Resolution. Receiver for entities allegedly involved in Ponzi scheme was not bound by arbitration agreement between entities and employees.",
"Cases","","","ASARCO, L.L.C. v. Montana Resources, Incorporated","https://www.westlaw.com/Document/I90091c5049f911e794a1f7ff5c621124/View/FullText.html?listSource=Search&list=CASE&rank=713&sessionScopeId=0066e1cf23c3ad09864e12e5e17a6d395f5650c427ebc0abee68fb245346c742&originationContext=Search%20Result&transitionType=SearchItem&contextData=%28sc.Default%29&VR=3.0&RS=cblt1.0","United States Court of Appeals, Fifth Circuit.","June 02, 2017","858 F.3d 949","","2017 WL 2407451","16-40682","BANKRUPTCY  Business Relationships. District court's failure to apply judicial estoppel to bar former debtor's action against its former partner was not abuse of discretion.",
"Cases","","","LaShip, L.L.C. v. Hayward Baker, Incorporated","https://www.westlaw.com/Document/Ic79d45e0003111e7b79af578703ae98c/View/FullText.html?listSource=Search&list=CASE&rank=714&sessionScopeId=0066e1cf23c3ad09864e12e5e17a6d395f5650c427ebc0abee68fb245346c742&originationContext=Search%20Result&transitionType=SearchItem&contextData=%28sc.Default%29&VR=3.0&RS=cblt1.0","United States Court of Appeals, Fifth Circuit.","March 01, 2017","680 Fed.Appx. 317","","2017 WL 829503","15-30816","COMMERCIAL LAW  Contracts. Contractor did not breach contract with property owner for soil stabilization work and installation of subterranean soil-mix columns.",
"Cases","","","Matter of Selenberg","https://www.westlaw.com/Document/I0d516f8033fe11e7afe7804507f6db3f/View/FullText.html?listSource=Search&list=CASE&rank=715&sessionScopeId=0066e1cf23c3ad09864e12e5e17a6d395f5650c427ebc0abee68fb245346c742&originationContext=Search%20Result&transitionType=SearchItem&contextData=%28sc.Default%29&VR=3.0&RS=cblt1.0","United States Court of Appeals, Fifth Circuit.","May 08, 2017","856 F.3d 393","","2017 WL 1822310","16-30649","BANKRUPTCY  Discharge. Debtor-attorney fraudulently obtained extension of credit in convincing ex-client to forego legal malpractice action.",
"Cases","","","Clarke's Allied, Incorporated v. Rail Source Fuel, L.L.C.","https://www.westlaw.com/Document/I15bd6e408c0511e6b8b9e1ce282dafae/View/FullText.html?listSource=Search&list=CASE&rank=716&sessionScopeId=0066e1cf23c3ad09864e12e5e17a6d395f5650c427ebc0abee68fb245346c742&originationContext=Search%20Result&transitionType=SearchItem&contextData=%28sc.Default%29&VR=3.0&RS=cblt1.0","United States Court of Appeals, Fifth Circuit.","October 05, 2016","662 Fed.Appx. 248","","2016 WL 5831565","15–41492","COMMERCIAL LAW  Arbitration. Arbitrator did not exceed his authority by awarding owner unsegregated costs associated with its defense of mechanic's lien claim by contractor.",
"Cases","","","Jacked Up, L.L.C. v. Sara Lee Corporation","https://www.westlaw.com/Document/I9fe7d4502a4511e7bc7a881983352365/View/FullText.html?listSource=Search&list=CASE&rank=717&sessionScopeId=0066e1cf23c3ad09864e12e5e17a6d395f5650c427ebc0abee68fb245346c742&originationContext=Search%20Result&transitionType=SearchItem&contextData=%28sc.Default%29&VR=3.0&RS=cblt1.0","United States Court of Appeals, Fifth Circuit.","April 25, 2017","854 F.3d 797","","2017 WL 1476174","15-11019","COMMERCIAL LAW  Contracts. Licensing agreement that provided parties with annual right of termination was ambiguous as to effective date of termination.",
"Cases","","","Hoffman v. L & M Arts","https://www.westlaw.com/Document/Ib3e2be30866111e6b8b9e1ce282dafae/View/FullText.html?listSource=Search&list=CASE&rank=718&sessionScopeId=0066e1cf23c3ad09864e12e5e17a6d395f5650c427ebc0abee68fb245346c742&originationContext=Search%20Result&transitionType=SearchItem&contextData=%28sc.Default%29&VR=3.0&RS=cblt1.0","United States Court of Appeals, Fifth Circuit.","September 28, 2016","838 F.3d 568","","2016 WL 5431818","15-10046, 15-10293","TORTS  Fraud. Art gallery's statement that a painting would disappear into buyer's private collection was not actionable on a fraudulent inducement claim.",
"Cases","","","In re Deepwater Horizon","https://www.westlaw.com/Document/Iad7fd540d6cb11e6ae36ba8bbc8f4702/View/FullText.html?listSource=Search&list=CASE&rank=719&sessionScopeId=0066e1cf23c3ad09864e12e5e17a6d395f5650c427ebc0abee68fb245346c742&originationContext=Search%20Result&transitionType=SearchItem&contextData=%28sc.Default%29&VR=3.0&RS=cblt1.0","United States Court of Appeals, Fifth Circuit.","January 06, 2017","845 F.3d 634","","2017 WL 74274","15-30599","ENERGY AND UTILITIES  Oil and Gas. Lender would not be required to pay restitution to oil spill settlement fund after being repaid by claimant who allegedly asserted fraudulent claim to fund.",
"Cases","","","Turner v. Young","https://www.westlaw.com/Document/I91da4f30d49111e8a174b18b713fc6d4/View/FullText.html?listSource=Search&list=CASE&rank=720&sessionScopeId=0066e1cf23c3ad09864e12e5e17a6d395f5650c427ebc0abee68fb245346c742&originationContext=Search%20Result&transitionType=SearchItem&contextData=%28sc.Default%29&VR=3.0&RS=cblt1.0","United States Court of Appeals, Fifth Circuit.","October 18, 2018","753 Fed.Appx. 267","","2018 WL 5099608","17-20485","COMMERCIAL LAW  Contracts. Under Texas law, seller of medical bill review company did not breach settlement agreement prohibiting seller from using purchaser's trade names.",
"Cases","","","Sellers v. Minerals Technologies, Incorporated","https://www.westlaw.com/Document/Iae2f9320d49111e8aec5b23c3317c9c0/View/FullText.html?listSource=Search&list=CASE&rank=721&sessionScopeId=0066e1cf23c3ad09864e12e5e17a6d395f5650c427ebc0abee68fb245346c742&originationContext=Search%20Result&transitionType=SearchItem&contextData=%28sc.Default%29&VR=3.0&RS=cblt1.0","United States Court of Appeals, Fifth Circuit.","October 18, 2018","753 Fed.Appx. 272","","2018 WL 5099611","17-20555","LABOR AND EMPLOYMENT  Contracts. Providing vice president with 30 days' notice of termination without cause was condition precedent to determining amount owed to him upon departure.",
"Cases","","","SCA Promotions, Incorporated v. Yahoo!, Incorporated","https://www.westlaw.com/Document/I3ff07e1086a911e7a3f3a229dca6c9c6/View/FullText.html?listSource=Search&list=CASE&rank=722&sessionScopeId=0066e1cf23c3ad09864e12e5e17a6d395f5650c427ebc0abee68fb245346c742&originationContext=Search%20Result&transitionType=SearchItem&contextData=%28sc.Default%29&VR=3.0&RS=cblt1.0","United States Court of Appeals, Fifth Circuit.","August 21, 2017","868 F.3d 378","","2017 WL 3585625","15-11254","COMMERCIAL LAW  Contracts. Contractual cancellation penalty was based on contract fee rather than installment payment.",
"Cases","Yellow KeyCite","https://www.westlaw.com/Link/RelatedInformation/Flag?docGuid=I7a025400aacd11e7afa98a813d24d32b&rank=723&listSource=Search&list=CASE&originationContext=Search%20Result&transitionType=SearchItem&contextData=%28sc.Default%29&VR=3.0&RS=cblt1.0","Ramirez v. United of Omaha Life Insurance Company","https://www.westlaw.com/Document/I7a025400aacd11e7afa98a813d24d32b/View/FullText.html?listSource=Search&list=CASE&rank=723&sessionScopeId=0066e1cf23c3ad09864e12e5e17a6d395f5650c427ebc0abee68fb245346c742&originationContext=Search%20Result&transitionType=SearchItem&contextData=%28sc.Default%29&VR=3.0&RS=cblt1.0","United States Court of Appeals, Fifth Circuit.","October 06, 2017","872 F.3d 721","","2017 WL 4455267","16-11660","LABOR AND EMPLOYMENT  Benefit Plans. Participant's loss of sight from coccidioidomycosis, a fungal infection that he contracted on work trip, was not covered by ERISA-governed accidental death and dismemberment plan.",
"Cases","","","Matter of Wiggains","https://www.westlaw.com/Document/Id0c9d460f39a11e681b2a67ea2e2f62b/View/FullText.html?listSource=Search&list=CASE&rank=724&sessionScopeId=0066e1cf23c3ad09864e12e5e17a6d395f5650c427ebc0abee68fb245346c742&originationContext=Search%20Result&transitionType=SearchItem&contextData=%28sc.Default%29&VR=3.0&RS=cblt1.0","United States Court of Appeals, Fifth Circuit.","February 14, 2017","848 F.3d 655","","77 Collier Bankr.Cas.2d 511","15-11249","BANKRUPTCY  Bankruptcy Estate. Statutory cap on homestead exemption limited proceeds payable to nondebtor-spouse.",
"Cases","Yellow KeyCite","https://www.westlaw.com/Link/RelatedInformation/Flag?docGuid=I2b3f93c0712e11e69e6ceb9009bbadab&rank=725&listSource=Search&list=CASE&originationContext=Search%20Result&transitionType=SearchItem&contextData=%28sc.Default%29&VR=3.0&RS=cblt1.0","Energy Coal v. CITGO Petroleum Corporation","https://www.westlaw.com/Document/I2b3f93c0712e11e69e6ceb9009bbadab/View/FullText.html?listSource=Search&list=CASE&rank=725&sessionScopeId=0066e1cf23c3ad09864e12e5e17a6d395f5650c427ebc0abee68fb245346c742&originationContext=Search%20Result&transitionType=SearchItem&contextData=%28sc.Default%29&VR=3.0&RS=cblt1.0","United States Court of Appeals, Fifth Circuit.","September 01, 2016","836 F.3d 457","","2016 WL 4575569","15-30863","LITIGATION  Choice of Law. Law of state of incorporation governed whether American company could be held liable for its Venezuelan affiliate's alleged breach of contract.",
"Cases","","","Boissier v. Katsur","https://www.westlaw.com/Document/I09adfa90e21b11e6ae36ba8bbc8f4702/View/FullText.html?listSource=Search&list=CASE&rank=726&sessionScopeId=0066e1cf23c3ad09864e12e5e17a6d395f5650c427ebc0abee68fb245346c742&originationContext=Search%20Result&transitionType=SearchItem&contextData=%28sc.Default%29&VR=3.0&RS=cblt1.0","United States Court of Appeals, Fifth Circuit.","January 20, 2017","676 Fed.Appx. 260","","2017 WL 318639","16-30463","LITIGATION  Judgment. Contractor's default was willful and thus contractor was not entitled to relief from default judgment entered against her.",
"Cases","","","In re 4-K Marine, L.L.C.","https://www.westlaw.com/Document/Ic494a36024ca11e98f4d8d23fc0d7c2b/View/FullText.html?listSource=Search&list=CASE&rank=727&sessionScopeId=0066e1cf23c3ad09864e12e5e17a6d395f5650c427ebc0abee68fb245346c742&originationContext=Search%20Result&transitionType=SearchItem&contextData=%28sc.Default%29&VR=3.0&RS=cblt1.0","United States Court of Appeals, Fifth Circuit.","January 30, 2019","914 F.3d 934","","2019 WL 362452","18-30348","MARITIME LAW  Maintenance and Cure. Tug wheelman's back injury was preexisting injury that was not caused or aggravated by allision.",
"Cases","","","Luppino v. York","https://www.westlaw.com/Document/I0539abd0bec111e6afc8be5a5c08bae9/View/FullText.html?listSource=Search&list=CASE&rank=728&sessionScopeId=0066e1cf23c3ad09864e12e5e17a6d395f5650c427ebc0abee68fb245346c742&originationContext=Search%20Result&transitionType=SearchItem&contextData=%28sc.Default%29&VR=3.0&RS=cblt1.0","United States District Court, W.D. Texas, San Antonio Division.","December 08, 2016","562 B.R. 894","","2016 WL 7176664","SA-16-CV-409-XR","BANKRUPTCY - Debtor Protections. Automatic stay would not be extended to non-debtor members of bankrupt limited liability company (LLC).",
"Cases","","","In re Aeon Operating, Inc.","https://www.westlaw.com/Document/I046d3f10ab1911e7a94fe1d3bccdca84/View/FullText.html?listSource=Search&list=CASE&rank=729&sessionScopeId=0066e1cf23c3ad09864e12e5e17a6d395f5650c427ebc0abee68fb245346c742&originationContext=Search%20Result&transitionType=SearchItem&contextData=%28sc.Default%29&VR=3.0&RS=cblt1.0","United States Bankruptcy Court, N.D. Texas, Dallas Division.","October 03, 2017","Slip Copy","","2017 WL 4457437","15-33935-HDH7, AP 17-03028","On April 11, 2017, Scott Seidel, as Chapter 7 trustee in the bankruptcy case of Aeon Operating, Inc. (the Trustee) filed his Original Complaint of the Trustee Against Mercury Operating, LLC and PetroRock Mineral Holdings, LLC [Docket No. 1] (the Complaint). Through the Complaint, the Trustee seeks the avoidance and...",
"Cases","","","In re ATP Oil & Gas Corporation","https://www.westlaw.com/Document/I62949a70052e11e7b28da5a53aeba485/View/FullText.html?listSource=Search&list=CASE&rank=730&sessionScopeId=0066e1cf23c3ad09864e12e5e17a6d395f5650c427ebc0abee68fb245346c742&originationContext=Search%20Result&transitionType=SearchItem&contextData=%28sc.Default%29&VR=3.0&RS=cblt1.0","United States District Court, S.D. Texas, Houston Division.","March 09, 2017","570 B.R. 764","","2017 WL 928135","CV H-16-2556, AP 12-3443","BANKRUPTCY - Claims. Service providers' liens were extinguished upon sale of overriding royalty interests to purchaser without notice..",
"Cases","","","Fozard v. C.R. England, Inc.","https://www.westlaw.com/Document/I3eea95d00d5211e7b123a7c0dc92d5ef/View/FullText.html?listSource=Search&list=CASE&rank=731&sessionScopeId=0066e1cf23c3ad09864e12e5e17a6d395f5650c427ebc0abee68fb245346c742&originationContext=Search%20Result&transitionType=SearchItem&contextData=%28sc.Default%29&VR=3.0&RS=cblt1.0","United States District Court, N.D. Texas, Dallas Division.","March 17, 2017","243 F.Supp.3d 789","","2017 WL 1036661","3:16-CV-1334-B","EDUCATION - Private and Vocational Schools. Truck driving school did not waive its right to arbitrate students' claims for violation of FLSA.",
"Cases","Red KeyCite","https://www.westlaw.com/Link/RelatedInformation/Flag?docGuid=I414cf8b0b69311e6ac07a76176915fee&rank=732&listSource=Search&list=CASE&originationContext=Search%20Result&transitionType=SearchItem&contextData=%28sc.Default%29&VR=3.0&RS=cblt1.0","Trois v. Apple Tree Auction Center, Inc.","https://www.westlaw.com/Document/I414cf8b0b69311e6ac07a76176915fee/View/FullText.html?listSource=Search&list=CASE&rank=732&sessionScopeId=0066e1cf23c3ad09864e12e5e17a6d395f5650c427ebc0abee68fb245346c742&originationContext=Search%20Result&transitionType=SearchItem&contextData=%28sc.Default%29&VR=3.0&RS=cblt1.0","United States District Court, W.D. Texas, San Antonio Division.","November 27, 2016","Not Reported in F.Supp.3d","","2016 WL 6956656","SA-16-CV-746-XR","On this day came on to be considered Defendants' Motion to dismiss (docket no. 2). Plaintiff initially filed this case in the 285 Judicial District Court of Bexar County, Texas. In Plaintiff's Original Petition he alleges that he was contacted by the Defendants to sell by auction several of his collectibles, including firearms and antiques....",
"Cases","","","Martinez v. State Farm Lloyds","https://www.westlaw.com/Document/I8588a2c0a66911e6b27be1b44e7e7e5b/View/FullText.html?listSource=Search&list=CASE&rank=733&sessionScopeId=0066e1cf23c3ad09864e12e5e17a6d395f5650c427ebc0abee68fb245346c742&originationContext=Search%20Result&transitionType=SearchItem&contextData=%28sc.Default%29&VR=3.0&RS=cblt1.0","United States District Court, S.D. Texas, McAllen Division.","November 08, 2016","Not Reported in F.Supp.3d","","2016 WL 6601052","7:16-CV-183","The Court now considers Defendant's Second Amended Motion for Summary Judgment, filed by State Farm Lloyds (Defendant) and the Agreed Motion to Extend the Scheduling Order Deadlines, filed by Gloria Martinez (Plaintiff) and Defendant. After duly considering the record and relevant authorities,...",
"Cases","","","Sabal Limited LP v. Deutsche Bank AG","https://www.westlaw.com/Document/I395dd5c0a10811e6972aa83e6c16e5f7/View/FullText.html?listSource=Search&list=CASE&rank=734&sessionScopeId=0066e1cf23c3ad09864e12e5e17a6d395f5650c427ebc0abee68fb245346c742&originationContext=Search%20Result&transitionType=SearchItem&contextData=%28sc.Default%29&VR=3.0&RS=cblt1.0","United States District Court, W.D. Texas, San Antonio Division.","November 01, 2016","Not Reported in F.Supp.3d","","2016 WL 6462300","5:16-CV-300-DAE","Before the Court is a Motion for Reconsideration filed by Sabal Limited, LP (Sabal or Plaintiff). (Dkt. # 25.) Pursuant to Local Rule CV-7(h), the Court finds this matter suitable for disposition without a hearing. After careful consideration of the memoranda filed in support of and in opposition to the pending motion,...",
"Cases","","","Tech Pharmacy Services, LLC v. Alixa RX LLC","https://www.westlaw.com/Document/I0441f240952811e6b8b9e1ce282dafae/View/FullText.html?listSource=Search&list=CASE&rank=735&sessionScopeId=0066e1cf23c3ad09864e12e5e17a6d395f5650c427ebc0abee68fb245346c742&originationContext=Search%20Result&transitionType=SearchItem&contextData=%28sc.Default%29&VR=3.0&RS=cblt1.0","United States District Court, E.D. Texas, Sherman Division.","October 17, 2016","Not Reported in F.Supp.3d","","2016 WL 6071601","4:15-CV-00766","Pending before the Court is Defendant Alixa RX LLC and Defendant Golden Gate National Senior Care LLC's (collectively, Defendants) Motion for Protective Order (Dkt. #68). After reviewing the relevant pleadings, the Court finds the motion should be denied. Plaintiff Tech Pharmacy Services, LLC (Tech Pharmacy) filed its...",
"Cases","","","Rodriguez v. Allstate Texas Lloyds","https://www.westlaw.com/Document/I2df5e350958f11e69e6ceb9009bbadab/View/FullText.html?listSource=Search&list=CASE&rank=736&sessionScopeId=0066e1cf23c3ad09864e12e5e17a6d395f5650c427ebc0abee68fb245346c742&originationContext=Search%20Result&transitionType=SearchItem&contextData=%28sc.Default%29&VR=3.0&RS=cblt1.0","United States District Court, S.D. Texas, McAllen Division.","October 17, 2016","Not Reported in F.Supp.3d","","2016 WL 6080521","7:16-CV-00498","The Court now considers Ida and Daniel Rodriguez's (Plaintiffs) motion to remand. After duly considering the record and authorities, the Court DENIES the motion. The Plaintiffs in this case insured their property with a policy provided by Allstate Texas Lloyds (Defendant). Plaintiffs' property allegedly suffered damage...",
"Cases","","","United States Small Business Administration v. Moorehead","https://www.westlaw.com/Document/I6259f310a17011e6bdb7b23a3c66d5b3/View/FullText.html?listSource=Search&list=CASE&rank=737&sessionScopeId=0066e1cf23c3ad09864e12e5e17a6d395f5650c427ebc0abee68fb245346c742&originationContext=Search%20Result&transitionType=SearchItem&contextData=%28sc.Default%29&VR=3.0&RS=cblt1.0","United States District Court, N.D. Texas, Dallas Division.","October 11, 2016","Not Reported in F.Supp.3d","","2016 WL 6471934","3:15-CV-1851-L-BK","Pursuant to the Order of Reference, Doc. 18, the Court now considers Plaintiff's Request for Entry of Default and Default Judgement, Doc. 16. For the reasons that follow, it is recommended that the motion be GRANTED to the extent stated herein. On May 28, 2015, Plaintiff filed this action asserting claims of breach of contract and common law fraud...",
"Cases","","","McClelland v. Chubb Lloyd's Insurance Company of Texas","https://www.westlaw.com/Document/I506c6a708acd11e6a46fa4c1b9f16bf3/View/FullText.html?listSource=Search&list=CASE&rank=738&sessionScopeId=0066e1cf23c3ad09864e12e5e17a6d395f5650c427ebc0abee68fb245346c742&originationContext=Search%20Result&transitionType=SearchItem&contextData=%28sc.Default%29&VR=3.0&RS=cblt1.0","United States District Court, W.D. Texas, San Antonio Division.","September 30, 2016","Not Reported in F.Supp.3d","","2016 WL 5791206","5:16-CV-00108","This case concerns a dispute over an insurance policy and subsequent denial of claims under the policy. Plaintiffs Kirk McClelland and Tamre McClelland brought suit against defendant Chubb Lloyd's, the insurer, and defendant Robert Lynn Pritchard, the claims adjuster, for breach of contract, violations of Sections 541 and 542 of the Texas Insurance...",
"Cases","Red KeyCite","https://www.westlaw.com/Link/RelatedInformation/Flag?docGuid=I827c8bd0855a11e69e6ceb9009bbadab&rank=739&listSource=Search&list=CASE&originationContext=Search%20Result&transitionType=SearchItem&contextData=%28sc.Default%29&VR=3.0&RS=cblt1.0","Maner v. Health","https://www.westlaw.com/Document/I827c8bd0855a11e69e6ceb9009bbadab/View/FullText.html?listSource=Search&list=CASE&rank=739&sessionScopeId=0066e1cf23c3ad09864e12e5e17a6d395f5650c427ebc0abee68fb245346c742&originationContext=Search%20Result&transitionType=SearchItem&contextData=%28sc.Default%29&VR=3.0&RS=cblt1.0","United States District Court, S.D. Texas, Galveston Division.","September 27, 2016","Not Reported in F.Supp.3d","","2016 WL 5394266","3:15-CV-191","Plaintiff, William Maner, filed this lawsuit against his former employer, Dignity Health, claiming that he was unlawfully terminated on the basis of sex, that he was unlawfully retaliated against after complaining of workplace discrimination, and for breach of contract. Dkt. 1. Dignity Health has filed a Motion to Dismiss under Federal Rules...",
"Cases","Red KeyCite","https://www.westlaw.com/Link/RelatedInformation/Flag?docGuid=I2c54c890870c11e6b8b9e1ce282dafae&rank=740&listSource=Search&list=CASE&originationContext=Search%20Result&transitionType=SearchItem&contextData=%28sc.Default%29&VR=3.0&RS=cblt1.0","Mid-Continent Casualty Co. v. Petroleum Solutions, Inc.","https://www.westlaw.com/Document/I2c54c890870c11e6b8b9e1ce282dafae/View/FullText.html?listSource=Search&list=CASE&rank=740&sessionScopeId=0066e1cf23c3ad09864e12e5e17a6d395f5650c427ebc0abee68fb245346c742&originationContext=Search%20Result&transitionType=SearchItem&contextData=%28sc.Default%29&VR=3.0&RS=cblt1.0","United States District Court, S.D. Texas, Houston Division.","September 29, 2016","Not Reported in F.Supp.3d","","2016 WL 5539895","CV 4:09-0422","I. Introduction II. Background A. The Fuel Tank and the Flex Connector B. The State Court Litigation C. Communications Between PSI and Mid-Continent D. Procedural...",
"Cases","","","Texas State Aquarium v. Fishman Chemical of North Carolina, LLC","https://www.westlaw.com/Document/I194b6ee07a5d11e69e6ceb9009bbadab/View/FullText.html?listSource=Search&list=CASE&rank=741&sessionScopeId=0066e1cf23c3ad09864e12e5e17a6d395f5650c427ebc0abee68fb245346c742&originationContext=Search%20Result&transitionType=SearchItem&contextData=%28sc.Default%29&VR=3.0&RS=cblt1.0","United States District Court, S.D. Texas, Corpus Christi Division.","September 13, 2016","Not Reported in F.Supp.3d","","2016 WL 4765057","2:15-CV-214","BE IT REMEMBERED that on September 13, 2016 the Court DENIED Plaintiff Texas State Aquarium Association D/B/A Texas State Aquarium's Motion for Summary Judgment and Motion for Default Judgment. Dkt. Nos. 49 and 56. On May 14, 2015 Plaintiff Texas State Aquarium Association D/B/A Texas State Aquarium (TSA) filed a complaint against...",
"Cases","","","Thermotek, Inc. v. Orthoflex, Inc.","https://www.westlaw.com/Document/I4f757880759e11e6a46fa4c1b9f16bf3/View/FullText.html?listSource=Search&list=CASE&rank=742&sessionScopeId=0066e1cf23c3ad09864e12e5e17a6d395f5650c427ebc0abee68fb245346c742&originationContext=Search%20Result&transitionType=SearchItem&contextData=%28sc.Default%29&VR=3.0&RS=cblt1.0","United States District Court, N.D. Texas, Dallas Division.","September 07, 2016","Not Reported in F.Supp.3d","","2016 WL 4678888","3:11-CV-0870-D, 3:10-CV-2618-D","After extensive pretrial proceedings, plaintiff-counterdefendant ThermoTek, Inc. (ThermoTek), defendants-counterplaintiffs Orthoflex, Inc. d/b/a Integrated Orthopedics (Orthoflex), Motion Medical Technologies, LLC (Motion Medical), Wabash Medical Company, LLC (Wabash Medical), and defendants...",
"Cases","","","National Collegiate Student Loan Trust 2006-3 v. Richards","https://www.westlaw.com/Document/I49f605806f4711e6b63ccfe393a33906/View/FullText.html?listSource=Search&list=CASE&rank=743&sessionScopeId=0066e1cf23c3ad09864e12e5e17a6d395f5650c427ebc0abee68fb245346c742&originationContext=Search%20Result&transitionType=SearchItem&contextData=%28sc.Default%29&VR=3.0&RS=cblt1.0","United States District Court, N.D. Texas, Dallas Division.","August 30, 2016","Not Reported in F.Supp.3d","","2016 WL 4533216","3:16-CV-1936-M","Before the Court is a Motion for Remand [Docket Entry #6], filed by Plaintiff National Collegiate Student Loan Trust 2006-3 (NCSLT). For the reasons explained below, the Motion is GRANTED. On August 10, 2015, NCSLT, a Delaware statutory trust, filed this lawsuit against Defendant Ernest Richards (Richards), a Texas...",
"Cases","","","Dallas County Hospital District v. NextGen Healthcare Information Systems, LLC","https://www.westlaw.com/Document/Ied887690d65011e6960ceb4fdef01e17/View/FullText.html?listSource=Search&list=CASE&rank=744&sessionScopeId=0066e1cf23c3ad09864e12e5e17a6d395f5650c427ebc0abee68fb245346c742&originationContext=Search%20Result&transitionType=SearchItem&contextData=%28sc.Default%29&VR=3.0&RS=cblt1.0","United States District Court, N.D. Texas, Dallas Division.","January 06, 2017","Not Reported in F.Supp.3d","","2017 WL 68014","3:15-CV-4063-B","Before the Court is Defendant NextGen Healthcare Information Systems, LLC's (NextGen) Motion to Dismiss Plaintiff Dallas County Hospital District's (Parkland) First Amended Complaint Pursuant to Rule 12(b)(1). Doc. 21. The parties argued their positions at a hearing on January 4, 2017. For the following reasons, the Court DENIES NextGen's Motion....",
