"Type","KeyCite Treatment","KeyCite URL","Title","Document URL","Court Line","Filed Date","Citation","Cite Caveat","Parallel Cite","Docket Num","Summary",
"Cases","","","Kennedy v. Jefferson County Hospital","https://www.westlaw.com/Document/I2b4133903d5411e7bffecab88ce1f178/View/FullText.html?listSource=Search&list=CASE&rank=1&sessionScopeId=0066e1cf23c3ad09864e12e5e17a6d395f5650c427ebc0abee68fb245346c742&originationContext=Search%20Result&transitionType=SearchItem&contextData=%28sc.Default%29&VR=3.0&RS=cblt1.0","United States Court of Appeals, Fifth Circuit.","May 18, 2017","689 Fed.Appx. 371","","2017 WL 2210660","16-60805","Jerry Kennedy was fired by Jefferson County Hospital. Kennedy filed for unemployment benefits, which were denied when an Administrative Law Judge from the Mississippi Department of Employment Security (MDES) found that Kennedy had been terminated for misconduct. His appeal of that decision to the MDES Board of Review was unsuccessful. Kennedy did...",
"Cases","","","Sasol North America, Incorporated v. GTLPetrol, L.L.C.","https://www.westlaw.com/Document/I419451900edd11e79c1dcfeada4fe8e0/View/FullText.html?listSource=Search&list=CASE&rank=2&sessionScopeId=0066e1cf23c3ad09864e12e5e17a6d395f5650c427ebc0abee68fb245346c742&originationContext=Search%20Result&transitionType=SearchItem&contextData=%28sc.Default%29&VR=3.0&RS=cblt1.0","United States Court of Appeals, Fifth Circuit.","March 20, 2017","682 Fed.Appx. 312","","2017 WL 1063462","16-20122","LITIGATION - Jurisdiction. Competitor's claims seeking declaratory judgment that it did not misappropriate trade secrets or breach confidentiality agreement were not ripe for review.",
"Cases","","","Phillips v. Home Path Financial, L.P.","https://www.westlaw.com/Document/Ia21890a0f48711e681b2a67ea2e2f62b/View/FullText.html?listSource=Search&list=CASE&rank=3&sessionScopeId=0066e1cf23c3ad09864e12e5e17a6d395f5650c427ebc0abee68fb245346c742&originationContext=Search%20Result&transitionType=SearchItem&contextData=%28sc.Default%29&VR=3.0&RS=cblt1.0","United States Court of Appeals, Fifth Circuit.","February 15, 2017","676 Fed.Appx. 358","","2017 WL 629270","15-11290","Caron Sue Phillips filed a pro se complaint in Texas state court against Home Path Financial, L.P. (Home Path) and JPMorgan Chase Bank (Chase), alleging that the property located at 12051 Vista Ranch Way, Fort Worth, Texas, was improperly sold following foreclosure. Specifically, she contended that Chase, the original mortgagee of the property,...",
"Cases","","","United States v. Mire","https://www.westlaw.com/Document/I4ab918e08a9a11e68bf9cabfb8a03530/View/FullText.html?listSource=Search&list=CASE&rank=4&sessionScopeId=0066e1cf23c3ad09864e12e5e17a6d395f5650c427ebc0abee68fb245346c742&originationContext=Search%20Result&transitionType=SearchItem&contextData=%28sc.Default%29&VR=3.0&RS=cblt1.0","United States Court of Appeals, Fifth Circuit.","September 30, 2016","838 F.3d 621","","2016 WL 5746308","15-50128","LITIGATION - Attachment and Garnishment. As a matter of first impression, government must be allowed to intervene in action directed at property subject to order of restitution.",
"Cases","","","Igwe v. Safeco Insurance Company of Indiana","https://www.westlaw.com/Document/Ic8fb37d0cc4b11e7b393b8b5a0417f3d/View/FullText.html?listSource=Search&list=CASE&rank=5&sessionScopeId=0066e1cf23c3ad09864e12e5e17a6d395f5650c427ebc0abee68fb245346c742&originationContext=Search%20Result&transitionType=SearchItem&contextData=%28sc.Default%29&VR=3.0&RS=cblt1.0","United States Court of Appeals, Fifth Circuit.","December 12, 2016","Not Reported in F.3d","","2016 WL 10571682","16-51013","This court must examine the basis of its jurisdiction, on its own motion if necessary. Hill v. City of Seven Points, 230 F.3d 167, 169 (5th Cir. 2000). Pursuant to 28 U.S.C. §2107(a) and Federal Rule of Appellate Procedure 4(a)(1)(A), the notice of appeal in a civil case must be filed within thirty days of entry of judgment. In this...",
"Cases","","","Claimant ID 100236236 v. BP Exploration & Production, Incorporated","https://www.westlaw.com/Document/I83deaee05c6911e7bcf2cc0f37ee205d/View/FullText.html?listSource=Search&list=CASE&rank=6&sessionScopeId=0066e1cf23c3ad09864e12e5e17a6d395f5650c427ebc0abee68fb245346c742&originationContext=Search%20Result&transitionType=SearchItem&contextData=%28sc.Default%29&VR=3.0&RS=cblt1.0","United States Court of Appeals, Fifth Circuit.","June 27, 2017","699 Fed.Appx. 308","","2017 WL 2791395","16-30521","COMMERCIAL LAW - Settlements. District court did not abuse its discretion in declining to review denial of claim under oil spill settlement agreement based on factual dispute.",
"Cases","","","In Matter of Issuance of Subpoenas Depositions of Bennett","https://www.westlaw.com/Document/I7514c2106f6a11e69981dc2250b07c82/View/FullText.html?listSource=Search&list=CASE&rank=7&sessionScopeId=0066e1cf23c3ad09864e12e5e17a6d395f5650c427ebc0abee68fb245346c742&originationContext=Search%20Result&transitionType=SearchItem&contextData=%28sc.Default%29&VR=3.0&RS=cblt1.0","Court of Appeals of Texas, Houston (14th Dist.).","August 30, 2016","502 S.W.3d 373","","2016 WL 4533670","14-16-00004-CV","LITIGATION - Discovery. Trial court could not quash or limit depositions for irrelevancy following letters rogatory issued by out-of-state court requesting depositions.",
"Cases","","","Thompson v. Thompson","https://www.westlaw.com/Document/I5ce6d070626c11e794a1f7ff5c621124/View/FullText.html?listSource=Search&list=CASE&rank=8&sessionScopeId=0066e1cf23c3ad09864e12e5e17a6d395f5650c427ebc0abee68fb245346c742&originationContext=Search%20Result&transitionType=SearchItem&contextData=%28sc.Default%29&VR=3.0&RS=cblt1.0","Court of Appeals of Texas, Dallas.","June 30, 2017","Not Reported in S.W.3d","","2017 WL 2871423","05-16-00026-CV","Husband appeals a judgment in favor of Wife for $834,700 in unpaid contractual alimony. In three issues, Husband generally contends (1) the trial court abused its discretion in modifying its judgment, (2) the alimony provision violated the Texas Family Code, and (3) the evidence is legally and factually insufficient to support the award of...",
"Cases","","","AME & FE Investments, Ltd. v. NEC Networks, LLC","https://www.westlaw.com/Document/I685858f0ce5211e7929ecf6e705a87cd/View/FullText.html?listSource=Search&list=CASE&rank=9&sessionScopeId=0066e1cf23c3ad09864e12e5e17a6d395f5650c427ebc0abee68fb245346c742&originationContext=Search%20Result&transitionType=SearchItem&contextData=%28sc.Default%29&VR=3.0&RS=cblt1.0","Court of Appeals of Texas, San Antonio.","November 20, 2017","--- S.W.3d ----","","2017 WL 5562590","04-17-00332-CV","LITIGATION - Appeals. Trial court was required to determine value of limited liability company shares in order to determine bond needed to enforce judgment pending appeal.",
"Cases","","","XTO Energy Inc. v. Goodwin","https://www.westlaw.com/Document/I51a8ace0b45811e79c8f8bb0457c507d/View/FullText.html?listSource=Search&list=CASE&rank=10&sessionScopeId=0066e1cf23c3ad09864e12e5e17a6d395f5650c427ebc0abee68fb245346c742&originationContext=Search%20Result&transitionType=SearchItem&contextData=%28sc.Default%29&VR=3.0&RS=cblt1.0","Court of Appeals of Texas, Tyler.","October 18, 2017","--- S.W.3d ----","","2017 WL 4675136","12-16-00068-CV","REAL PROPERTY - Mineral Rights and Interests. Oil and gas lessor had ownership interest in subsurface of his property at depth of lessee's cased wellbore intrusion, supporting trespass claim.",
"Cases","","","In re M & O Homebuilders, Inc.","https://www.westlaw.com/Document/I5ab19940e9c011e6b28da5a53aeba485/View/FullText.html?listSource=Search&list=CASE&rank=11&sessionScopeId=0066e1cf23c3ad09864e12e5e17a6d395f5650c427ebc0abee68fb245346c742&originationContext=Search%20Result&transitionType=SearchItem&contextData=%28sc.Default%29&VR=3.0&RS=cblt1.0","Court of Appeals of Texas, Houston (1st Dist.).","February 02, 2017","516 S.W.3d 101","","2017 WL 444445","01-16-00602-CV","LITIGATION - Judgment. Amended order removing finality language corrected judicial error, and thus was void as it was signed after trial court's plenary power expired.",
"Cases","","","Border Demolition & Environmental, Inc. v. Pineda","https://www.westlaw.com/Document/If8b686c0c4f611e79c8f8bb0457c507d/View/FullText.html?listSource=Search&list=CASE&rank=12&sessionScopeId=0066e1cf23c3ad09864e12e5e17a6d395f5650c427ebc0abee68fb245346c742&originationContext=Search%20Result&transitionType=SearchItem&contextData=%28sc.Default%29&VR=3.0&RS=cblt1.0","Court of Appeals of Texas, El Paso.","November 08, 2017","535 S.W.3d 140","","2017 WL 5167550","08-16-00094-CV","LEGAL SERVICES - Malpractice. Genuine issue of material fact existed as to whether attorney knew client relied on him for representation or advice, precluding summary judgment.",
"Cases","","","In re Mesa Petroleum Partners, LP","https://www.westlaw.com/Document/I30f29220c5b711e7bf23e096364180a5/View/FullText.html?listSource=Search&list=CASE&rank=13&sessionScopeId=0066e1cf23c3ad09864e12e5e17a6d395f5650c427ebc0abee68fb245346c742&originationContext=Search%20Result&transitionType=SearchItem&contextData=%28sc.Default%29&VR=3.0&RS=cblt1.0","Court of Appeals of Texas, El Paso.","November 09, 2017","538 S.W.3d 153","","2017 WL 5185191","08-17-00195-CV","LITIGATION - Writs. Court refused to render judgment in reasonable time, for purposes of mandamus relief based on trial court's failure to perform ministerial duty.",
"Cases","","","University of Incarnate Word v. Redus","https://www.westlaw.com/Document/Id2714070222211e8b25db53553f40f1b/View/FullText.html?listSource=Search&list=CASE&rank=14&sessionScopeId=0066e1cf23c3ad09864e12e5e17a6d395f5650c427ebc0abee68fb245346c742&originationContext=Search%20Result&transitionType=SearchItem&contextData=%28sc.Default%29&VR=3.0&RS=cblt1.0","Court of Appeals of Texas, San Antonio.","March 07, 2018","--- S.W.3d ----","","2018 WL 1176652","04-15-00120-CV","EDUCATION - Immunity. University's police department was not a governmental unit eligible for governmental immunity from suit under common law sovereign immunity doctrine.",
"Cases","","","DLA Piper LLP (US) v. Linegar","https://www.westlaw.com/Document/Ifb7c1530e6bd11e78c5db03c58f2bc1d/View/FullText.html?listSource=Search&list=CASE&rank=15&sessionScopeId=0066e1cf23c3ad09864e12e5e17a6d395f5650c427ebc0abee68fb245346c742&originationContext=Search%20Result&transitionType=SearchItem&contextData=%28sc.Default%29&VR=3.0&RS=cblt1.0","Court of Appeals of Texas, Eastland.","December 21, 2017","539 S.W.3d 512","","2017 WL 6559658","11-12-00201-CV","LEGAL SERVICES - Malpractice. Jury's award of $1,293,606 in damages for stockholder was not excessive in legal malpractice action against law firm.",
"Cases","","","Fitzgerald v. Water Rock Outdoors, LLC","https://www.westlaw.com/Document/Icfc35e00da2211e7929ecf6e705a87cd/View/FullText.html?listSource=Search&list=CASE&rank=16&sessionScopeId=0066e1cf23c3ad09864e12e5e17a6d395f5650c427ebc0abee68fb245346c742&originationContext=Search%20Result&transitionType=SearchItem&contextData=%28sc.Default%29&VR=3.0&RS=cblt1.0","Court of Appeals of Texas, Amarillo.","December 01, 2017","536 S.W.3d 112","","2017 WL 6015444","07-16-00330-CV","TORTS - Fraud. Statements that construction company was a high quality custom homebuilder, hardworking, and honest were merely puffing or opinion.",
"Cases","","","Leavitt v. Ballard Exploration Company, Inc.","https://www.westlaw.com/Document/I3a576550db6711e7af08dbc2fa7f734f/View/FullText.html?listSource=Search&list=CASE&rank=17&sessionScopeId=0066e1cf23c3ad09864e12e5e17a6d395f5650c427ebc0abee68fb245346c742&originationContext=Search%20Result&transitionType=SearchItem&contextData=%28sc.Default%29&VR=3.0&RS=cblt1.0","Court of Appeals of Texas, Houston (1st Dist.).","December 07, 2017","540 S.W.3d 164","","2017 WL 6043695","01-16-00536-CV","REAL PROPERTY - Mineral Rights and Interests. Dispute as to title that would affect distribution of payments existed as to right to royalties of trust with interest in unit containing gas well.",
"Cases","","","TMRJ Holdings, Inc. v. Inhance Technologies, LLC","https://www.westlaw.com/Document/Ic0404600f56111e79fcefd9d4766cbba/View/FullText.html?listSource=Search&list=CASE&rank=18&sessionScopeId=0066e1cf23c3ad09864e12e5e17a6d395f5650c427ebc0abee68fb245346c742&originationContext=Search%20Result&transitionType=SearchItem&contextData=%28sc.Default%29&VR=3.0&RS=cblt1.0","Court of Appeals of Texas, Houston (1st Dist.).","January 09, 2018","540 S.W.3d 202","","2018 WL 326421","01-16-00849-CV","COMMERCIAL LAW - Injunction. Permanent injunction prohibiting business's use of competitor's trade secrets related to production of fluorine gas was impermissibly broad.",
"Cases","","","In Estate of Larson","https://www.westlaw.com/Document/I80c8cd40db6611e7af08dbc2fa7f734f/View/FullText.html?listSource=Search&list=CASE&rank=19&sessionScopeId=0066e1cf23c3ad09864e12e5e17a6d395f5650c427ebc0abee68fb245346c742&originationContext=Search%20Result&transitionType=SearchItem&contextData=%28sc.Default%29&VR=3.0&RS=cblt1.0","Court of Appeals of Texas, Houston (14th Dist.).","December 07, 2017","541 S.W.3d 368","","2017 WL 6045582","14-16-00587-CV","ESTATE PLANNING AND PROBATE - Attorney Fees. Probate court lacked authority to authorize payment from testator's probate estate to lawyers for services rendered in guardianship proceeding.",
"Cases","","","Lindsey Construction, Inc. v. AutoNation Financial Services, LLC","https://www.westlaw.com/Document/I9ef53f00db6211e78c5db03c58f2bc1d/View/FullText.html?listSource=Search&list=CASE&rank=20&sessionScopeId=0066e1cf23c3ad09864e12e5e17a6d395f5650c427ebc0abee68fb245346c742&originationContext=Search%20Result&transitionType=SearchItem&contextData=%28sc.Default%29&VR=3.0&RS=cblt1.0","Court of Appeals of Texas, Houston (14th Dist.).","December 07, 2017","541 S.W.3d 355","","2017 WL 6045568","14-16-00190-CV","COMMERCIAL LAW - Contracts. Car dealership did not assent to term that it would purchase truck since any statement of price at which it would purchase was made to truck lessee.",
"Cases","","","In re Cokinos, Boisien & Young","https://www.westlaw.com/Document/I0a06287077d311e79657885de1b1150a/View/FullText.html?listSource=Search&list=CASE&rank=21&sessionScopeId=0066e1cf23c3ad09864e12e5e17a6d395f5650c427ebc0abee68fb245346c742&originationContext=Search%20Result&transitionType=SearchItem&contextData=%28sc.Default%29&VR=3.0&RS=cblt1.0","Court of Appeals of Texas, Dallas.","July 25, 2017","523 S.W.3d 901","","2017 WL 3275999","05-16-01331-CV","LITIGATION - Discovery. Law firm was required to provide to estate of deceased lawyer copies of correspondence, which may have been relevant to a fee-sharing dispute between the estate and firm.",
"Cases","","","In re M.W.M., Jr.","https://www.westlaw.com/Document/I73e922701a9411e79eadef7f77b52ba6/View/FullText.html?listSource=Search&list=CASE&rank=22&sessionScopeId=0066e1cf23c3ad09864e12e5e17a6d395f5650c427ebc0abee68fb245346c742&originationContext=Search%20Result&transitionType=SearchItem&contextData=%28sc.Default%29&VR=3.0&RS=cblt1.0","Court of Appeals of Texas, Dallas.","April 05, 2017","523 S.W.3d 203","","2017 WL 1245422","05-16-00797-CV","FAMILY LAW - Alternative Dispute Resolution. Trial court's order removing arbitrator and appointing substitute were an abuse of discretion, warranting mandamus relief in child custody proceeding.",
"Cases","","","Godoy v. Wells Fargo Bank, N.A.","https://www.westlaw.com/Document/I66baf7b0bf1f11e7b38a81315a4346f0/View/FullText.html?listSource=Search&list=CASE&rank=23&sessionScopeId=0066e1cf23c3ad09864e12e5e17a6d395f5650c427ebc0abee68fb245346c742&originationContext=Search%20Result&transitionType=SearchItem&contextData=%28sc.Default%29&VR=3.0&RS=cblt1.0","Court of Appeals of Texas, Houston (14th Dist.).","October 31, 2017","542 S.W.3d 50","","2017 WL 4930902","14-16-00599-CV","COMMERCIAL LAW - Guaranty. Guarantor's waiver of any and all rights or defenses to action to collect deficiency following foreclosure included statute of limitations defense.",
"Cases","Yellow KeyCite","https://www.westlaw.com/Link/RelatedInformation/Flag?docGuid=I867503c01be011e8a60be941ad402919&rank=24&listSource=Search&list=CASE&originationContext=Search%20Result&transitionType=SearchItem&contextData=%28sc.Default%29&VR=3.0&RS=cblt1.0","In re Minix","https://www.westlaw.com/Document/I867503c01be011e8a60be941ad402919/View/FullText.html?listSource=Search&list=CASE&rank=24&sessionScopeId=0066e1cf23c3ad09864e12e5e17a6d395f5650c427ebc0abee68fb245346c742&originationContext=Search%20Result&transitionType=SearchItem&contextData=%28sc.Default%29&VR=3.0&RS=cblt1.0","Court of Appeals of Texas, Houston (14th Dist.).","February 27, 2018","543 S.W.3d 446","","2018 WL 1069558","14–17–00417–CV","FAMILY LAW - Child Custody. Family Code does not allow parties to agree to revoke an otherwise binding mediated settlement agreement (MSA).",
"Cases","","","Lion Co-Polymers Holdings, LLC v. Lion Polymers, LLC","https://www.westlaw.com/Document/I654eb9207afe11e8b29df1bcacd7c41c/View/FullText.html?listSource=Search&list=CASE&rank=25&sessionScopeId=0066e1cf23c3ad09864e12e5e17a6d395f5650c427ebc0abee68fb245346c742&originationContext=Search%20Result&transitionType=SearchItem&contextData=%28sc.Default%29&VR=3.0&RS=cblt1.0","Court of Appeals of Texas, Houston (1st Dist.).","June 28, 2018","Not Reported in S.W. Rptr.","","2018 WL 3150863","01-16-00848-CV","Appellant, Lion Co-Polymers Holdings, LLC (the Company), challenges the trial courts summary judgment granted in favor of appellee, Lion Polymers, LLC (LP), on LPs breach-of-contract claim against the Company. In six issues, the Company contends that the trial court erred in granting summary judgment and...",
"Cases","","","Martinez v. State","https://www.westlaw.com/Document/I798d7810054b11e781b2a67ea2e2f62b/View/FullText.html?listSource=Search&list=CASE&rank=26&sessionScopeId=0066e1cf23c3ad09864e12e5e17a6d395f5650c427ebc0abee68fb245346c742&originationContext=Search%20Result&transitionType=SearchItem&contextData=%28sc.Default%29&VR=3.0&RS=cblt1.0","Court of Appeals of Texas, Corpus Christi-Edinburg.","March 09, 2017","527 S.W.3d 310","","2017 WL 929481","13–15–00295–CR","CRIMINAL JUSTICE - Witnesses. Defendant was not entitled to mistrial based on court's comment, in reply to State's motion to treat witness as hostile, that witness was difficult.",
"Cases","","","Connor v. Connor","https://www.westlaw.com/Document/I5c9180108f5d11e88be5ff0f408d813f/View/FullText.html?listSource=Search&list=CASE&rank=27&sessionScopeId=0066e1cf23c3ad09864e12e5e17a6d395f5650c427ebc0abee68fb245346c742&originationContext=Search%20Result&transitionType=SearchItem&contextData=%28sc.Default%29&VR=3.0&RS=cblt1.0","Court of Appeals of Texas, Houston (1st Dist.).","July 24, 2018","Not Reported in S.W. Rptr.","","2018 WL 3542911","01-17-00268-CV","Appellant Madeleine Connor appeals from the trial courts January 30, 2017 order on appellants motion for enforcement. Appellee Cabrach Connor filed a motion to dismiss the appeal, arguing that appellant waived her right to appeal. Appellant responded to the motion at the courts request. The parties entered into a mediated...",
"Cases","","","GFH Funding, Ltd. v. Kraken Holdings, LLC","https://www.westlaw.com/Document/I9128779089e311e88be5ff0f408d813f/View/FullText.html?listSource=Search&list=CASE&rank=28&sessionScopeId=0066e1cf23c3ad09864e12e5e17a6d395f5650c427ebc0abee68fb245346c742&originationContext=Search%20Result&transitionType=SearchItem&contextData=%28sc.Default%29&VR=3.0&RS=cblt1.0","Court of Appeals of Texas, Houston (1st Dist.).","July 17, 2018","Not Reported in S.W. Rptr.","","2018 WL 3431852","01-16-00853-CV","Appellants, GFH Funding, Ltd. (GFH) and Gonzalez Financial Holdings, Inc. (Gonzalez), appeal from the trial courts judgment rendered in favor of appellee, Kraken Holdings, LLC (Kraken), on its breach of contract action. In five issues, GFH and Gonzalez contend that (1) the reporters record is...",
"Cases","","","Dortch v. Boxer Property Management Corporation","https://www.westlaw.com/Document/If98d27d089df11e8b29df1bcacd7c41c/View/FullText.html?listSource=Search&list=CASE&rank=29&sessionScopeId=0066e1cf23c3ad09864e12e5e17a6d395f5650c427ebc0abee68fb245346c742&originationContext=Search%20Result&transitionType=SearchItem&contextData=%28sc.Default%29&VR=3.0&RS=cblt1.0","Court of Appeals of Texas, Houston (1st Dist.).","July 17, 2018","Not Reported in S.W. Rptr.","","2018 WL 3431733","01-17-00148-CV","Appellant Kenneth Dortch sued his former employer, appellee Boxer Property Management Corporation, after Boxers long-term disability insurance carrier, Reliance, denied Dortch benefits under its plan. Reliance concluded that, in 2010 (when Dortch suffered an on-the-job injury), Dortch was not covered under its policy. In 2015, Dortch sued...",
"Cases","","","1320/1390 Don Haskins, Ltd. v. Xerox Commercial Solutions, LLC","https://www.westlaw.com/Document/Id0e8ce0053ee11e88a14e1fba2b51c53/View/FullText.html?listSource=Search&list=CASE&rank=30&sessionScopeId=0066e1cf23c3ad09864e12e5e17a6d395f5650c427ebc0abee68fb245346c742&originationContext=Search%20Result&transitionType=SearchItem&contextData=%28sc.Default%29&VR=3.0&RS=cblt1.0","Court of Appeals of Texas, El Paso.","May 09, 2018","--- S.W.3d ----","","2018 WL 2126911","08-16-00027-CV","REAL PROPERTY - Landlord and Tenant. End date for commercial lease between landlord and tenant could reasonably be implied for parties' temporary parking agreement, which lacked end date.",
"Cases","","","McCoy v. Platinum Power Moves, Inc.","https://www.westlaw.com/Document/I2503e580910011e8809390da5fe55bec/View/FullText.html?listSource=Search&list=CASE&rank=31&sessionScopeId=0066e1cf23c3ad09864e12e5e17a6d395f5650c427ebc0abee68fb245346c742&originationContext=Search%20Result&transitionType=SearchItem&contextData=%28sc.Default%29&VR=3.0&RS=cblt1.0","Court of Appeals of Texas, Houston (1st Dist.).","July 26, 2018","Not Reported in S.W. Rptr.","","2018 WL 3581021","01-17-00653-CV","In this interlocutory appeal, Platinum Power Moves, Inc., an Oklahoma company, sued Wilbart McCoy, a Georgia resident, for breach of contract in Texas state court. McCoy filed a special appearance, arguing that he lacked sufficient contacts with Texas for Texas courts to exercise personal jurisdiction over him. The trial court denied McCoys...",
"Cases","","","Morello v. Seaway Crude Pipeline Company, LLC","https://www.westlaw.com/Document/Ibd2c5f705dd111e8a6608077647c238b/View/FullText.html?listSource=Search&list=CASE&rank=32&sessionScopeId=0066e1cf23c3ad09864e12e5e17a6d395f5650c427ebc0abee68fb245346c742&originationContext=Search%20Result&transitionType=SearchItem&contextData=%28sc.Default%29&VR=3.0&RS=cblt1.0","Court of Appeals of Texas, Houston (1st Dist.).","May 22, 2018","--- S.W.3d ----","","2018 WL 2305541","01-16-00765-CV","REAL PROPERTY - Eminent Domain. Landowner's proposed expert-witness testimony about building a rail-served industrial development center was based on a speculative future use.",
"Cases","","","Masa Custom Homes, LLC v. Shahin","https://www.westlaw.com/Document/I4509038036d611e888d5f23feb60b681/View/FullText.html?listSource=Search&list=CASE&rank=33&sessionScopeId=0066e1cf23c3ad09864e12e5e17a6d395f5650c427ebc0abee68fb245346c742&originationContext=Search%20Result&transitionType=SearchItem&contextData=%28sc.Default%29&VR=3.0&RS=cblt1.0","Court of Appeals of Texas, Dallas.","April 02, 2018","547 S.W.3d 332","","2018 WL 1581203","05-16-00978-CV","LITIGATION - Judgment. Judgment for property owner was void for having been signed by judge who did not preside over bench trial in action for fraud against home builder.",
"Cases","","","Hernandez v. Hernandez","https://www.westlaw.com/Document/Ie9f8264033a311e89d46ed79fb792237/View/FullText.html?listSource=Search&list=CASE&rank=34&sessionScopeId=0066e1cf23c3ad09864e12e5e17a6d395f5650c427ebc0abee68fb245346c742&originationContext=Search%20Result&transitionType=SearchItem&contextData=%28sc.Default%29&VR=3.0&RS=cblt1.0","Court of Appeals of Texas, El Paso.","March 29, 2018","547 S.W.3d 898","","2018 WL 1531460","08-17-00141-CV","REAL PROPERTY - Mortgages and Deeds of Trust. Title passed to winning bidders at post-foreclosure online auction at closing and not when grantor signed special warranty deed.",
"Cases","","","ICP, LLC v. Busse","https://www.westlaw.com/Document/I1e04c560a16811e888e382e865ea2ff8/View/FullText.html?listSource=Search&list=CASE&rank=35&sessionScopeId=0066e1cf23c3ad09864e12e5e17a6d395f5650c427ebc0abee68fb245346c742&originationContext=Search%20Result&transitionType=SearchItem&contextData=%28sc.Default%29&VR=3.0&RS=cblt1.0","Court of Appeals of Texas, Beaumont.","August 16, 2018","Not Reported in S.W. Rptr.","","2018 WL 3887636","09-17-00409-CV","In a single issue, appellant ICP, LLC (ICP) appeals the trial courts judgment finding that substantial evidence exists to support the Texas Workforce Commissions (the TWC) administrative decision requiring ICP to pay contractual severance benefits to Albert C. Busse. We affirm the trial courts...",
