"Type","KeyCite Treatment","KeyCite URL","Title","Document URL","Court Line","Filed Date","Citation","Cite Caveat","Parallel Cite","Docket Num","Summary",
"Cases","","","Cantu v. Texana Rice, Inc.","https://www.westlaw.com/Document/Ib65455a0ce3c11e8ae6bb4b0ae8dca5a/View/FullText.html?listSource=Search&list=CASE&rank=266&sessionScopeId=0066e1cf23c3ad09864e12e5e17a6d395f5650c427ebc0abee68fb245346c742&originationContext=Search%20Result&transitionType=SearchItem&contextData=%28sc.Default%29&VR=3.0&RS=cblt1.0","United States District Court, S.D. Texas, Brownsville Division.","September 25, 2018","Slip Copy","","2018 WL 4938696","CV B-05-170","Plaintiff Carlos Villarreal Cantu (Cantu) currently has a complaint pending against Defendant Texana Rice, Inc. (Texana Rice) for breach of contract, quantum meruit, and misappropriation of trade secrets. Dkt. No. 1. On June 6, 2007, following a mediation hearing, the Court abated this action, pending the outcome of...",
"Cases","","","Yado v. Palomar Specialty Insurance Company","https://www.westlaw.com/Document/Ia008aae017a711e89eae9724b55643c5/View/FullText.html?listSource=Search&list=CASE&rank=267&sessionScopeId=0066e1cf23c3ad09864e12e5e17a6d395f5650c427ebc0abee68fb245346c742&originationContext=Search%20Result&transitionType=SearchItem&contextData=%28sc.Default%29&VR=3.0&RS=cblt1.0","United States District Court, S.D. Texas, McAllen Division.","May 11, 2017","Slip Copy","","2017 WL 7735159","7:17-CV-00083","The Court now considers Hector Yados (Plaintiff) motion to remand and to recover attorneys fees, as well as Palomar Specialty Insurance Companys (Defendant) response. After duly considering the record and relevant authorities, the Court DENIES the motion. This is an insurance case stemming from a...",
"Cases","","","Rodriguez v. Hartford Life and Accident Insurance Company","https://www.westlaw.com/Document/I76e16cf03c9811e7a6b0f3e4b1d2c082/View/FullText.html?listSource=Search&list=CASE&rank=268&sessionScopeId=0066e1cf23c3ad09864e12e5e17a6d395f5650c427ebc0abee68fb245346c742&originationContext=Search%20Result&transitionType=SearchItem&contextData=%28sc.Default%29&VR=3.0&RS=cblt1.0","United States District Court, S.D. Texas, Houston Division.","May 17, 2017","Not Reported in Fed. Supp.","","2017 WL 2191636","CV H–16–3186","Pending before the court is Defendant's Motion to Dismiss Plaintiff's Second Amended Complaint (Defendant's Motion to Dismiss) (Docket Entry No. 25). For the reasons stated below, the motion will be granted. Plaintiff, Ricardo Rodriguez, initiated this suit against Hartford Life and Accident Insurance Company (Hartford)...",
"Cases","","","Time Insurance Agency, Inc. v. Hanover Insurance Co.","https://www.westlaw.com/Document/I1c954510a25311e8809390da5fe55bec/View/FullText.html?listSource=Search&list=CASE&rank=269&sessionScopeId=0066e1cf23c3ad09864e12e5e17a6d395f5650c427ebc0abee68fb245346c742&originationContext=Search%20Result&transitionType=SearchItem&contextData=%28sc.Default%29&VR=3.0&RS=cblt1.0","United States District Court, W.D. Texas, Austin Division.","August 15, 2018","Slip Copy","","2018 WL 3946544","A-17-CA-969 LY","Before the Court are Defendant's Amended Motion to Dismiss (Dkt. No. 11); Plaintiff's Response (Dkt. No. 12); and Defendant's Reply (Dkt. No. 14). The District Court referred the above motion to the undersigned Magistrate Judge for a report and recommendation pursuant to 28 U.S.C. §636(b) and Rule 1(c) of Appendix C of the Local Court...",
"Cases","","","Nay Company v. Navigators Specialty Insurance Company","https://www.westlaw.com/Document/I67b5e400340311e8a054a06708233710/View/FullText.html?listSource=Search&list=CASE&rank=270&sessionScopeId=0066e1cf23c3ad09864e12e5e17a6d395f5650c427ebc0abee68fb245346c742&originationContext=Search%20Result&transitionType=SearchItem&contextData=%28sc.Default%29&VR=3.0&RS=cblt1.0","United States District Court, N.D. Texas, Dallas Division.","January 19, 2018","Slip Copy","","2018 WL 1536341","3:16-CV-02675-N","This Order addresses Plaintiff the Nay Companys (Nay) motion to strike [38], Defendant Navigators Specialty Insurance Companys (Navigators) motion to strike [49], and Nays motion for protective order and to extend deadlines [68]. For the reasons set forth below, the Court denies the motions to strike...",
"Cases","","","Meng v. Nye","https://www.westlaw.com/Document/I1562fa907daa11e7bb97edaf3db64019/View/FullText.html?listSource=Search&list=CASE&rank=271&sessionScopeId=0066e1cf23c3ad09864e12e5e17a6d395f5650c427ebc0abee68fb245346c742&originationContext=Search%20Result&transitionType=SearchItem&contextData=%28sc.Default%29&VR=3.0&RS=cblt1.0","United States District Court, N.D. Texas, Dallas Division.","August 08, 2017","Not Reported in Fed. Supp.","","2017 WL 3421140","3:17-CV-00077-M","Molly Meng, Plaintiff, sued Stephen Nye (Nye), individually, and DLS Global, LLC (DLS or DLSG) (collectively, Defendants), for breach of contract and fraud/fraudulent inducement. Before the Court are Defendants' Motions to Dismiss [ECF Nos. 8, 9] for lack of subject matter jurisdiction under...",
"Cases","","","Brigandi v. American Mortgage Investment Partners Fund I Trust","https://www.westlaw.com/Document/I16d4223077d511e7b7978f65e9bf93b3/View/FullText.html?listSource=Search&list=CASE&rank=272&sessionScopeId=0066e1cf23c3ad09864e12e5e17a6d395f5650c427ebc0abee68fb245346c742&originationContext=Search%20Result&transitionType=SearchItem&contextData=%28sc.Default%29&VR=3.0&RS=cblt1.0","United States District Court, E.D. Texas, Sherman Division.","August 02, 2017","Not Reported in Fed. Supp.","","2017 WL 3276032","4:16-CV-520","Came on for consideration the report of the United States Magistrate Judge in this action, this matter having been heretofore referred to the Magistrate Judge pursuant to 28 U.S.C. §636. On May 31, 2017, the report of the Magistrate Judge (Dkt. #33) was entered containing proposed findings of fact and recommendations that Defendants...",
"Cases","","","Physicians ACO, LLC v. Computer Sciences Corporation","https://www.westlaw.com/Document/Iac4301f0732b11e79657885de1b1150a/View/FullText.html?listSource=Search&list=CASE&rank=273&sessionScopeId=0066e1cf23c3ad09864e12e5e17a6d395f5650c427ebc0abee68fb245346c742&originationContext=Search%20Result&transitionType=SearchItem&contextData=%28sc.Default%29&VR=3.0&RS=cblt1.0","United States District Court, S.D. Texas, Houston Division.","July 26, 2017","Not Reported in Fed. Supp.","","2017 WL 3187609","4:16–CV–1293","Pending before the Court is Plaintiff Physician ACO, LLCs (PACO) Motion for Reconsideration. (Document No. 23). Defendants Computer Sciences Corporation and CSRA Inc. (collectively Defendants) have filed a Response. (Document No. 24). Having considered these filings and the applicable law, the Court concludes that...",
"Cases","","","Xinyang Hualong Minerals Co., Ltd. v. Delgado","https://www.westlaw.com/Document/I8d99f630769d11e7b7978f65e9bf93b3/View/FullText.html?listSource=Search&list=CASE&rank=274&sessionScopeId=0066e1cf23c3ad09864e12e5e17a6d395f5650c427ebc0abee68fb245346c742&originationContext=Search%20Result&transitionType=SearchItem&contextData=%28sc.Default%29&VR=3.0&RS=cblt1.0","United States District Court, S.D. Texas, Houston Division.","July 28, 2017","Not Reported in Fed. Supp.","","2017 WL 3236113","4:16-CV-0104","Pending before the Court in this breach of contract case is Plaintiff Xinyang Hualong Minerals Co., Ltd.s (Plaintiff) Rule 54(d) Motion for Attorneys Fees (Motion) [Doc. # 33]. Defendant John Delgado, doing business as PetroFrac Global Logistics (Delgado or...",
"Cases","","","Surrey Oaks LLC v. Evanston Insurance Company","https://www.westlaw.com/Document/I5ec908906dde11e794a1f7ff5c621124/View/FullText.html?listSource=Search&list=CASE&rank=275&sessionScopeId=0066e1cf23c3ad09864e12e5e17a6d395f5650c427ebc0abee68fb245346c742&originationContext=Search%20Result&transitionType=SearchItem&contextData=%28sc.Default%29&VR=3.0&RS=cblt1.0","United States District Court, N.D. Texas, Fort Worth Division.","July 19, 2017","Not Reported in Fed. Supp.","","2017 WL 3085861","4:16-CV-516-A","Came on for consideration the motion of defendant, Evanston Insurance Company (Evanston), for summary judgment. Plaintiffs, Surrey Oaks LLC, Stanley Xu (Xu), and Nanling Chen (Chen), have filed a response, and Evanston has filed a reply. Having considered the motion, the response, the reply, the entire...",
"Cases","","","Cowan v. Sentry Insurance a Mutual Company","https://www.westlaw.com/Document/I7ddace707cc611e7bcf2cc0f37ee205d/View/FullText.html?listSource=Search&list=CASE&rank=276&sessionScopeId=0066e1cf23c3ad09864e12e5e17a6d395f5650c427ebc0abee68fb245346c742&originationContext=Search%20Result&transitionType=SearchItem&contextData=%28sc.Default%29&VR=3.0&RS=cblt1.0","United States District Court, N.D. Texas, Fort Worth Division.","July 19, 2017","Not Reported in Fed. Supp.","","2017 WL 3394185","4:17-CV-00437-O-BP","Before the Court are Defendants Motion to Abate Lawsuit (ECF No. 4), Appendix in Support (ECF No. 5), and Brief in Support (ECF No. 6), all filed June 1, 2017; Plaintiffs Response to Defendants Motion to Abate Lawsuit (ECF No. 11), Brief in Support (ECF No. 12), and Appendix in Support (ECF No. 13), all filed June 30, 2017; and...",
"Cases","","","Hess Corporation v. Schlumberger Technology Corporation","https://www.westlaw.com/Document/Ic4440cd05e7811e794a1f7ff5c621124/View/FullText.html?listSource=Search&list=CASE&rank=277&sessionScopeId=0066e1cf23c3ad09864e12e5e17a6d395f5650c427ebc0abee68fb245346c742&originationContext=Search%20Result&transitionType=SearchItem&contextData=%28sc.Default%29&VR=3.0&RS=cblt1.0","United States District Court, S.D. Texas, Houston Division.","June 29, 2017","Not Reported in Fed. Supp.","","92 UCC Rep.Serv.2d 1183","CV H–16–3415","Pending before the court is Defendants Motion to Dismiss Second Amended Complaint Under Rule 12(b)(6) (Defendants Motion to Dismiss) (Docket Entry No. 29). For the reasons stated below, the motion will be granted in part and denied in part. This case arises from the sale and subsequent failure of several Subsurface...",
"Cases","","","Rehabcare Group East, Inc. v. Madison Oak Management, Inc.","https://www.westlaw.com/Document/Ib7dfcee0698e11e7b7978f65e9bf93b3/View/FullText.html?listSource=Search&list=CASE&rank=278&sessionScopeId=0066e1cf23c3ad09864e12e5e17a6d395f5650c427ebc0abee68fb245346c742&originationContext=Search%20Result&transitionType=SearchItem&contextData=%28sc.Default%29&VR=3.0&RS=cblt1.0","United States District Court, W.D. Texas, San Antonio Division.","April 19, 2017","Not Reported in Fed. Supp.","","2017 WL 2999977","SA–16–CV–00606–XR","On this date, the Court considered Plaintiff's Motion for Partial Summary Judgment (Docket no. 27). After careful consideration, the Court GRANTS the motion. This is a breach of contract case. The case arises from an agreement between RehabCare Group Therapy Services (Plaintiff) and Madison Oak Management, Inc. d/b/a Stone Oak Care Center...",
"Cases","","","Santander Consumer USA, Inc. v. Homer Skelton Enterprises, Inc.","https://www.westlaw.com/Document/Ic136222050e611e7bcf2cc0f37ee205d/View/FullText.html?listSource=Search&list=CASE&rank=279&sessionScopeId=0066e1cf23c3ad09864e12e5e17a6d395f5650c427ebc0abee68fb245346c742&originationContext=Search%20Result&transitionType=SearchItem&contextData=%28sc.Default%29&VR=3.0&RS=cblt1.0","United States District Court, N.D. Texas, Dallas Division.","June 13, 2017","Not Reported in Fed. Supp.","","2017 WL 2558804","3:17-CV-0568-G","Before the court is the motion for a more definite statement under Rule 12(e) and the motion to dismiss for failure to state a claim under Rule 12(b)(6) filed by the defendant (docket entry 4). For the reasons stated below, the motions are denied. This breach of contract action arises out of an automobile retail installment contract entered into...",
"Cases","","","Wallace v. Access Self Storage Red Oak","https://www.westlaw.com/Document/I8be645506b7111e7bcf2cc0f37ee205d/View/FullText.html?listSource=Search&list=CASE&rank=280&sessionScopeId=0066e1cf23c3ad09864e12e5e17a6d395f5650c427ebc0abee68fb245346c742&originationContext=Search%20Result&transitionType=SearchItem&contextData=%28sc.Default%29&VR=3.0&RS=cblt1.0","United States District Court, N.D. Texas, Dallas Division.","June 20, 2017","Not Reported in Fed. Supp.","","2017 WL 3017233","3:17-CV-1602-M-BH","Pursuant to Special Order No. 3-251, this pro se case has been automatically referred for screening. Based on the relevant filings and applicable law, the plaintiffs claims should be DISMISSED. On June 16, 2017, the plaintiff filed this pro se case against a storage facility that seeks to auction her property. (See doc. 3.) She contends that...",
"Cases","","","3T Oil and Gas Services, LLC v. JPMorgan Chase Bank, N.A.","https://www.westlaw.com/Document/I0b3e21c0d20911e8ae6bb4b0ae8dca5a/View/FullText.html?listSource=Search&list=CASE&rank=281&sessionScopeId=0066e1cf23c3ad09864e12e5e17a6d395f5650c427ebc0abee68fb245346c742&originationContext=Search%20Result&transitionType=SearchItem&contextData=%28sc.Default%29&VR=3.0&RS=cblt1.0","United States District Court, W.D. Texas, Austin Division.","October 16, 2018","Slip Copy","","2018 WL 5018483","A-18-CV-131-LY","Before the Court are Defendants Motion to Dismiss and Motion to Strike Plaintiffs First Amended Complaint (Dkt. No. 7); Plaintiffs Response (Dkt. No. 8); Defendants Reply (Dkt. No. 9); and Plaintiffs Sur-Reply (Dkt. No. 12). The District Court referred the motion to the undersigned Magistrate Judge for report and...",
"Cases","","","Washington v. Plano ISD","https://www.westlaw.com/Document/I65baa6d04fbb11e88a14e1fba2b51c53/View/FullText.html?listSource=Search&list=CASE&rank=282&sessionScopeId=0066e1cf23c3ad09864e12e5e17a6d395f5650c427ebc0abee68fb245346c742&originationContext=Search%20Result&transitionType=SearchItem&contextData=%28sc.Default%29&VR=3.0&RS=cblt1.0","United States District Court, E.D. Texas, Sherman Division.","May 11, 2017","Slip Copy","","2017 WL 9252266","4:15-CV-00789-ALM-CAN","Pending before the Court is Plaintiff Bennie P. Washington's (Plaintiff or Appellant) pro se Motion to Proceed in Forma Pauperis [Dkt. 78] and Affidavit Accompanying Motion for Permission to Appeal in Forma Pauperis [Dkt. 81]. Having considered the relevant pleadings, including Plaintiff's Notice of Appeal [Dkt. 77], the...",
"Cases","","","In re Ultra Petroleum Corp.","https://www.westlaw.com/Document/I0c696460e6db11e8a174b18b713fc6d4/View/FullText.html?listSource=Search&list=CASE&rank=283&sessionScopeId=0066e1cf23c3ad09864e12e5e17a6d395f5650c427ebc0abee68fb245346c742&originationContext=Search%20Result&transitionType=SearchItem&contextData=%28sc.Default%29&VR=3.0&RS=cblt1.0","United States Bankruptcy Court, S.D. Texas, Houston Division.","November 09, 2018","Slip Copy","","2018 WL 5905797","16-32202, AP 17-3019","Gasconade Oil Co., Riggs Oil & Gas Corp., and The Roy H. Dubitzky Trust filed this adversary proceeding against Ultra Resources, Inc. and UPL Pinedale, LLC, seeking a declaratory judgment that they are entitled to certain overriding royalty interests pursuant to the Areas of Mutual Interest clause within the parties' Southwestern Wyoming Revised...",
"Cases","","","Balistreri-Amrhein v. Verrilli","https://www.westlaw.com/Document/I6936d5404fbb11e8abc79f7928cdeab9/View/FullText.html?listSource=Search&list=CASE&rank=284&sessionScopeId=0066e1cf23c3ad09864e12e5e17a6d395f5650c427ebc0abee68fb245346c742&originationContext=Search%20Result&transitionType=SearchItem&contextData=%28sc.Default%29&VR=3.0&RS=cblt1.0","United States District Court, E.D. Texas, Sherman Division.","October 07, 2016","Slip Copy","","2016 WL 11191119","4:16-CV-00112-ALM-CAN","On February 11, 2016, Plaintiffs Darlene C. Balistreri-Amrhein (Ms. Amrhein) and Anthony J. Balistreri, deceased (Mr. Amrhein) (collectively Plaintiffs) filed a Motion to Proceed In Forma Pauperis [Dkt. 3], which the Court provisionally granted on February 19, 2016 [Dkt. 4]. Thereafter, on March 7, 2016,...",
"Cases","","","Butler v. Endeavor Air","https://www.westlaw.com/Document/Ie8c9e5505e6a11e89034f60e1699ddbe/View/FullText.html?listSource=Search&list=CASE&rank=285&sessionScopeId=0066e1cf23c3ad09864e12e5e17a6d395f5650c427ebc0abee68fb245346c742&originationContext=Search%20Result&transitionType=SearchItem&contextData=%28sc.Default%29&VR=3.0&RS=cblt1.0","United States District Court, S.D. Texas, Houston Division.","March 08, 2018","Slip Copy","","2018 WL 2321986","CV H-16-3711","Pending is Defendant Endeavor Air d/b/a Delta Connection, Inc.s Motion for Summary Judgment (Document No. 19). After carefully considering the motion, response, and applicable law, the Court concludes for the reasons that follow that the motion should be denied. Plaintiff Kiante Butler (Plaintiff) alleges that Defendant...",
"Cases","","","Nerium Skincare, Inc. v. Nerium International, LLC","https://www.westlaw.com/Document/Iccd622505e6a11e88a14e1fba2b51c53/View/FullText.html?listSource=Search&list=CASE&rank=286&sessionScopeId=0066e1cf23c3ad09864e12e5e17a6d395f5650c427ebc0abee68fb245346c742&originationContext=Search%20Result&transitionType=SearchItem&contextData=%28sc.Default%29&VR=3.0&RS=cblt1.0","United States District Court, N.D. Texas, Dallas Division.","May 02, 2018","Slip Copy","","2018 WL 2321955","3:16-CV-1217-B","On June 28, 2017, the Court appointed, pursuant to Federal Rule of Civil Procedure 53, retired United States Magistrate Judge Jeff Kaplan as the Special Master in this case. Doc. 281, Order Appointing Special Master. On March 8, 2018, Judge Kaplan issued a report and recommendation in which he recommended that the Nerium Plaintiffs' claims for...",
"Cases","","","Gulf Marine Fabricators, LP v. ATP Innovator","https://www.westlaw.com/Document/I6d34bc10340a11e8a054a06708233710/View/FullText.html?listSource=Search&list=CASE&rank=287&sessionScopeId=0066e1cf23c3ad09864e12e5e17a6d395f5650c427ebc0abee68fb245346c742&originationContext=Search%20Result&transitionType=SearchItem&contextData=%28sc.Default%29&VR=3.0&RS=cblt1.0","United States District Court, S.D. Texas, Corpus Christi Division.","January 17, 2018","Slip Copy","","2018 WL 1536638","CV 2:16-430","This action arises from Gulf Marine Fabricators, LPs (Gulf Marine) in personam breach of contract claims against Amerindo Services Ltd. (Amerindo) and Blue Sky Langsa, Ltd. (Blue Sky) for past due fees, interest, and liquidated damages arising from a layberth agreement between the parties. Gulf...",
"Cases","","","McClelland v. Chubb Lloyd's Insurance Company of Texas","https://www.westlaw.com/Document/I2947bdf0940e11e7abd4d53a4dbd6890/View/FullText.html?listSource=Search&list=CASE&rank=288&sessionScopeId=0066e1cf23c3ad09864e12e5e17a6d395f5650c427ebc0abee68fb245346c742&originationContext=Search%20Result&transitionType=SearchItem&contextData=%28sc.Default%29&VR=3.0&RS=cblt1.0","United States District Court, W.D. Texas, San Antonio Division.","September 06, 2017","Not Reported in Fed. Supp.","","2017 WL 3909614","5:16–CV–00108","This case is a dispute over insurance policy coverage and the conduct of the defendant insurer, Chubb Lloyd's Insurance Company of Texas (Chubb Lloyd's), in its payments totaling $145,290.72 to the plaintiff-insureds, Kirk and Tamre McClelland for a covered loss. The McClellands asserted that they were entitled to greater amounts and brought...",
"Cases","","","Hazen v. Allstate Insurance Company","https://www.westlaw.com/Document/I1ce9fe70833211e79657885de1b1150a/View/FullText.html?listSource=Search&list=CASE&rank=289&sessionScopeId=0066e1cf23c3ad09864e12e5e17a6d395f5650c427ebc0abee68fb245346c742&originationContext=Search%20Result&transitionType=SearchItem&contextData=%28sc.Default%29&VR=3.0&RS=cblt1.0","United States District Court, S.D. Texas, Houston Division.","August 16, 2017","Not Reported in Fed. Supp.","","2017 WL 3506862","4:16–CV–3068","Pending before the Court are Defendant Allstate Insurance Companys Motion to Sever and Abate Plaintiffs ExtraContractual Claims and Motion for Leave to File Amended Answer. (Doc. No. 9, Doc. No. 10.) Plaintiff Elizabeth Hazen has responded in opposition to the motion for severance and abatement (Doc. No. 11.), but not to the...",
"Cases","","","Culver v. United Commerce Centers, Inc.","https://www.westlaw.com/Document/Ic78edc808fc411e7a4449fe394270729/View/FullText.html?listSource=Search&list=CASE&rank=290&sessionScopeId=0066e1cf23c3ad09864e12e5e17a6d395f5650c427ebc0abee68fb245346c742&originationContext=Search%20Result&transitionType=SearchItem&contextData=%28sc.Default%29&VR=3.0&RS=cblt1.0","United States District Court, N.D. Texas, Dallas Division.","October 24, 2016","Not Reported in Fed. Supp.","","2016 WL 9558837","3:16-CV-01055-M","Before the Court is Defendants' Motion to Dismiss for Failure to State a Claim [ECF No. 10]. For the reasons stated below, the Motion is GRANTED IN PART and DENIED IN PART. On April 19, 2016, Plaintiffs Steve Wesley Culver and his wife, Cassie Charlene Culver, filed suit against Mr. Culvers former employer, United Commerce Centers, Inc....",
"Cases","","","Four Six Services, LLC v. Dyer","https://www.westlaw.com/Document/I1f9d74c0748311e794a1f7ff5c621124/View/FullText.html?listSource=Search&list=CASE&rank=291&sessionScopeId=0066e1cf23c3ad09864e12e5e17a6d395f5650c427ebc0abee68fb245346c742&originationContext=Search%20Result&transitionType=SearchItem&contextData=%28sc.Default%29&VR=3.0&RS=cblt1.0","United States District Court, W.D. Texas, Austin Division.","December 29, 2016","Not Reported in Fed. Supp.","","2016 WL 9409013","A-16-CA-1269-SS","BE IT REMEMBERED that on the 28th day of December 2016, the Court held a hearing in the above-styled cause, and the parties appeared either in person or through counsel. At the hearing, the Court heard evidence on Plaintiff Four Six Services, LLC (Four Six)'s Motion for a Temporary Restraining Order and Preliminary Injunction [#2]. The Court...",
"Cases","","","Padro v. Lowe's Homes Centers, LLC","https://www.westlaw.com/Document/I29f02030748311e7b7978f65e9bf93b3/View/FullText.html?listSource=Search&list=CASE&rank=292&sessionScopeId=0066e1cf23c3ad09864e12e5e17a6d395f5650c427ebc0abee68fb245346c742&originationContext=Search%20Result&transitionType=SearchItem&contextData=%28sc.Default%29&VR=3.0&RS=cblt1.0","United States District Court, W.D. Texas, San Antonio Division.","September 01, 2016","Not Reported in Fed. Supp.","","2016 WL 9409014","SA:16-CV-709-DAE","Before the Court is Plaintiff Daniel Padro's Motion to Remand. (Dkt. # 4.) Pursuant to Local Rule CV-7(h), the Court finds this matter suitable for disposition without a hearing. After careful consideration of the memoranda in support of and in opposition to the motion, the Court, for the reasons that follow, DENIES Plaintiff's motion. On June 14,...",
"Cases","","","Doe v. Humble Independent School District","https://www.westlaw.com/Document/I110991a0ccca11e8afcec29e181e0751/View/FullText.html?listSource=Search&list=CASE&rank=293&sessionScopeId=0066e1cf23c3ad09864e12e5e17a6d395f5650c427ebc0abee68fb245346c742&originationContext=Search%20Result&transitionType=SearchItem&contextData=%28sc.Default%29&VR=3.0&RS=cblt1.0","United States District Court, S.D. Texas, Houston Division.","September 18, 2018","Slip Copy","","2018 WL 4906314","CV H-18-0079","Pending and referred is Defendant Humble Independent School Districts Motion to Dismiss Pursuant to Rules 12(b)(1) and 12(b)(6) (Document No. 14). Having considered that motion, the absence of a response to the motion, the claims and allegations in Plaintiffs First Amended Complaint (Document No. 13), and the applicable law, the...",
"Cases","","","In re National Truck Funding LLC","https://www.westlaw.com/Document/I33d08f6001fd11e8b565bb5dd3180177/View/FullText.html?listSource=Search&list=CASE&rank=294&sessionScopeId=0066e1cf23c3ad09864e12e5e17a6d395f5650c427ebc0abee68fb245346c742&originationContext=Search%20Result&transitionType=SearchItem&contextData=%28sc.Default%29&VR=3.0&RS=cblt1.0","United States Bankruptcy Court, S.D. Mississippi.","January 24, 2018","589 B.R. 294","","2018 WL 543005","17–51243–KMS, AP 17–06049–KMS","BANKRUPTCY  Claims. Rental payments for debtor's semi-trucks constituted proceeds of collateral.",
"Cases","","","In re Kappa Development and General Contracting Inc.","https://www.westlaw.com/Document/Ifc4e57e0c03211e7b3adfa6a631648d5/View/FullText.html?listSource=Search&list=CASE&rank=295&sessionScopeId=0066e1cf23c3ad09864e12e5e17a6d395f5650c427ebc0abee68fb245346c742&originationContext=Search%20Result&transitionType=SearchItem&contextData=%28sc.Default%29&VR=3.0&RS=cblt1.0","United States Bankruptcy Court, S.D. Mississippi.","October 31, 2017","589 B.R. 302","","2017 WL 4990438","17–51155–KMS, AP 17–06046–KMS","BANKRUPTCY  Bankruptcy Estate. Funds that federal government paid to debtor for prepetition construction project were property of the estate, despite surety's competing interest.",
"Cases","","","In re Parkman","https://www.westlaw.com/Document/I650009e0ab4311e8943bb2cb5f7224e8/View/FullText.html?listSource=Search&list=CASE&rank=296&sessionScopeId=0066e1cf23c3ad09864e12e5e17a6d395f5650c427ebc0abee68fb245346c742&originationContext=Search%20Result&transitionType=SearchItem&contextData=%28sc.Default%29&VR=3.0&RS=cblt1.0","United States Bankruptcy Court, S.D. Mississippi.","August 13, 2018","589 B.R. 567","","2018 WL 4091804","18-50032-KMS","BANKRUPTCY  Plans. Nonstandard provisions rendered proposed Chapter 13 plan unconfirmable.",
