"Type","KeyCite Treatment","KeyCite URL","Title","Document URL","Court Line","Filed Date","Citation","Cite Caveat","Parallel Cite","Docket Num","Summary",
"Cases","Yellow KeyCite","https://www.westlaw.com/Link/RelatedInformation/Flag?docGuid=I3753b3c0a9fa11e7afa98a813d24d32b&rank=475&listSource=Search&list=CASE&originationContext=Search%20Result&transitionType=SearchItem&contextData=%28sc.Default%29&VR=3.0&RS=cblt1.0","In re Liberty County Mutual Insurance Company","https://www.westlaw.com/Document/I3753b3c0a9fa11e7afa98a813d24d32b/View/FullText.html?listSource=Search&list=CASE&rank=475&sessionScopeId=0066e1cf23c3ad09864e12e5e17a6d395f5650c427ebc0abee68fb245346c742&originationContext=Search%20Result&transitionType=SearchItem&contextData=%28sc.Default%29&VR=3.0&RS=cblt1.0","Court of Appeals of Texas, Houston (1st Dist.).","October 05, 2017","537 S.W.3d 214","","2017 WL 4414033","01-17-00363-CV","INSURANCE - Automobile. Motorist was not entitled to depose her insurer's claims adjuster in action seeking declaration that insurer was obligated to pay UM benefits.",
"Cases","","","Abraham v. Acton","https://www.westlaw.com/Document/Ibd5fa770fc0811e78338c2a2b93e47e8/View/FullText.html?listSource=Search&list=CASE&rank=476&sessionScopeId=0066e1cf23c3ad09864e12e5e17a6d395f5650c427ebc0abee68fb245346c742&originationContext=Search%20Result&transitionType=SearchItem&contextData=%28sc.Default%29&VR=3.0&RS=cblt1.0","Court of Appeals of Texas, El Paso.","January 17, 2018","539 S.W.3d 521","","2018 WL 447183","08-16-00351-CV","REAL PROPERTY - Motion Practice. Trial court was required to conduct oral hearing on prospective purchaser's motion to reinstate case that had been dismissed for want of prosecution.",
"Cases","Yellow KeyCite","https://www.westlaw.com/Link/RelatedInformation/Flag?docGuid=Id75b80e0129711e8b0f5f1ddd5677a94&rank=477&listSource=Search&list=CASE&originationContext=Search%20Result&transitionType=SearchItem&contextData=%28sc.Default%29&VR=3.0&RS=cblt1.0","Miller v. Walker","https://www.westlaw.com/Document/Id75b80e0129711e8b0f5f1ddd5677a94/View/FullText.html?listSource=Search&list=CASE&rank=477&sessionScopeId=0066e1cf23c3ad09864e12e5e17a6d395f5650c427ebc0abee68fb245346c742&originationContext=Search%20Result&transitionType=SearchItem&contextData=%28sc.Default%29&VR=3.0&RS=cblt1.0","Court of Appeals of Texas, Fort Worth.","February 15, 2018","--- S.W.3d ----","","2018 WL 895602","02-17-00035-CV","LITIGATION - Alternative Dispute Resolution. Submissions to arbitration panel amended arbitration agreement to authorize attorneys' fees to operator of financial practice individually.",
"Cases","","","Hogan v. Goldsmith","https://www.westlaw.com/Document/I58c55fe0ce5d11e7b393b8b5a0417f3d/View/FullText.html?listSource=Search&list=CASE&rank=478&sessionScopeId=0066e1cf23c3ad09864e12e5e17a6d395f5650c427ebc0abee68fb245346c742&originationContext=Search%20Result&transitionType=SearchItem&contextData=%28sc.Default%29&VR=3.0&RS=cblt1.0","Court of Appeals of Texas, Eastland.","November 16, 2017","533 S.W.3d 921","","2017 WL 5587891","11-15-00330-CV","LITIGATION - Judgment. A genuine issue of material fact existed as to whether tenant was ready, willing, and able to exercise his option under lease-purchase agreement.",
"Cases","","","Smith v. Smith","https://www.westlaw.com/Document/I32d81dc0c63511e7a814f1ab34e02c4f/View/FullText.html?listSource=Search&list=CASE&rank=479&sessionScopeId=0066e1cf23c3ad09864e12e5e17a6d395f5650c427ebc0abee68fb245346c742&originationContext=Search%20Result&transitionType=SearchItem&contextData=%28sc.Default%29&VR=3.0&RS=cblt1.0","Court of Appeals of Texas, Houston (14th Dist.).","November 09, 2017","541 S.W.3d 251","","2017 WL 5196244","14-16-00467-CV","LABOR AND EMPLOYMENT - Contracts. There was no evidence that former sales agent was entitled to any commissions or other compensation under the Texas Labor Code.",
"Cases","","","Reynoso v. Dibs US, Inc.","https://www.westlaw.com/Document/Ia2ebb230d9d011e7b393b8b5a0417f3d/View/FullText.html?listSource=Search&list=CASE&rank=480&sessionScopeId=0066e1cf23c3ad09864e12e5e17a6d395f5650c427ebc0abee68fb245346c742&originationContext=Search%20Result&transitionType=SearchItem&contextData=%28sc.Default%29&VR=3.0&RS=cblt1.0","Court of Appeals of Texas, Houston (14th Dist.).","December 05, 2017","541 S.W.3d 331","","2017 WL 6003692","14-16-00323-CV","REAL PROPERTY - Mortgages and Deeds of Trust. The statute governing forcible detainer does not violate procedural or substantive due process rights.",
"Cases","","","Bergenholtz v. Eskenazi","https://www.westlaw.com/Document/Iba654580309c11e7afe7804507f6db3f/View/FullText.html?listSource=Search&list=CASE&rank=481&sessionScopeId=0066e1cf23c3ad09864e12e5e17a6d395f5650c427ebc0abee68fb245346c742&originationContext=Search%20Result&transitionType=SearchItem&contextData=%28sc.Default%29&VR=3.0&RS=cblt1.0","Court of Appeals of Texas, El Paso.","May 03, 2017","521 S.W.3d 397","","2017 WL 1684729","08–15–00144–CV","FAMILY LAW - Settlements. Ex-husband did not withdraw consent to settlement agreement, giving trial court authority to grant ex-wife's motion to reduce agreement to judgment.",
"Cases","","","In re Allstate Vehicle and Property Insurance Company","https://www.westlaw.com/Document/I644164f017ef11e89eae9724b55643c5/View/FullText.html?listSource=Search&list=CASE&rank=482&sessionScopeId=0066e1cf23c3ad09864e12e5e17a6d395f5650c427ebc0abee68fb245346c742&originationContext=Search%20Result&transitionType=SearchItem&contextData=%28sc.Default%29&VR=3.0&RS=cblt1.0","Court of Appeals of Texas, Beaumont.","February 22, 2018","542 S.W.3d 815","","2018 WL 1003794","09-18-00024-CV","INSURANCE - Property. Insurer's delay in invoking appraisal process did not waive right to invoke appraisal clause in homeowners insurance policy.",
"Cases","","","In re Lombana","https://www.westlaw.com/Document/I75805570d9cc11e7b393b8b5a0417f3d/View/FullText.html?listSource=Search&list=CASE&rank=483&sessionScopeId=0066e1cf23c3ad09864e12e5e17a6d395f5650c427ebc0abee68fb245346c742&originationContext=Search%20Result&transitionType=SearchItem&contextData=%28sc.Default%29&VR=3.0&RS=cblt1.0","Court of Appeals of Texas, Houston (14th Dist.).","December 05, 2017","542 S.W.3d 699","","2017 WL 6003561","14-17-00698-CV","LABOR AND EMPLOYMENT - Stays. Principles of comity did not warrant stay of employee's suit against employer after Colombia Labor Court adjudicated employee's claims to judgment.",
"Cases","","","Zhu v. First Community Insurance Company","https://www.westlaw.com/Document/I81c217d0111011e8b0f5f1ddd5677a94/View/FullText.html?listSource=Search&list=CASE&rank=484&sessionScopeId=0066e1cf23c3ad09864e12e5e17a6d395f5650c427ebc0abee68fb245346c742&originationContext=Search%20Result&transitionType=SearchItem&contextData=%28sc.Default%29&VR=3.0&RS=cblt1.0","Court of Appeals of Texas, Houston (14th Dist.).","February 13, 2018","543 S.W.3d 428","","2018 WL 842350","14-16-00226-CV","INSURANCE - Arbitration and Appraisal. Insured did not assert ground for setting aside appraisal award, and thus was bound by award and was estopped from bringing breach-of-contract claim.",
"Cases","","","Comerica Bank v. Progressive Trade Enterprises, Inc.","https://www.westlaw.com/Document/I426bc58017ec11e8b0f5f1ddd5677a94/View/FullText.html?listSource=Search&list=CASE&rank=485&sessionScopeId=0066e1cf23c3ad09864e12e5e17a6d395f5650c427ebc0abee68fb245346c742&originationContext=Search%20Result&transitionType=SearchItem&contextData=%28sc.Default%29&VR=3.0&RS=cblt1.0","Court of Appeals of Texas, Houston (14th Dist.).","February 22, 2018","544 S.W.3d 459","","2018 WL 1004888","14-17-00283-CV","FINANCE AND BANKING - Loans. Purported owner and holder of promissory note conclusively demonstrated that it owned and held note and was entitled to recover from maker of note.",
"Cases","Red KeyCite","https://www.westlaw.com/Link/RelatedInformation/Flag?docGuid=Icfb41c70bdd511e6b27be1b44e7e7e5b&rank=486&listSource=Search&list=CASE&originationContext=Search%20Result&transitionType=SearchItem&contextData=%28sc.Default%29&VR=3.0&RS=cblt1.0","Johnson v. State","https://www.westlaw.com/Document/Icfb41c70bdd511e6b27be1b44e7e7e5b/View/FullText.html?listSource=Search&list=CASE&rank=486&sessionScopeId=0066e1cf23c3ad09864e12e5e17a6d395f5650c427ebc0abee68fb245346c742&originationContext=Search%20Result&transitionType=SearchItem&contextData=%28sc.Default%29&VR=3.0&RS=cblt1.0","Court of Appeals of Texas, Fort Worth.","December 08, 2016","513 S.W.3d 190","","2016 WL 7163298","02–15–00357–CR","CRIMINAL JUSTICE - Larceny. Evidence was insufficient to support theft convictions arising from funeral home's failure to perform cremation and burial services.",
"Cases","","","Worthing v. Deutsche Bank National Trust Company for Agent Securities Inc.","https://www.westlaw.com/Document/Ie1861240765411e7bb97edaf3db64019/View/FullText.html?listSource=Search&list=CASE&rank=487&sessionScopeId=0066e1cf23c3ad09864e12e5e17a6d395f5650c427ebc0abee68fb245346c742&originationContext=Search%20Result&transitionType=SearchItem&contextData=%28sc.Default%29&VR=3.0&RS=cblt1.0","Court of Appeals of Texas, El Paso.","July 31, 2017","545 S.W.3d 127","","2017 WL 3225014","08-16-00009-CV","REAL PROPERTY - Homestead. Amendment to state constitutional homestead provision that eliminated a mortgage lender's ability to cure certain defects did not apply retroactively.",
"Cases","","","In re Sun City Gun Exchange, Inc.","https://www.westlaw.com/Document/I3678e5b0379f11e7bc7a881983352365/View/FullText.html?listSource=Search&list=CASE&rank=488&sessionScopeId=0066e1cf23c3ad09864e12e5e17a6d395f5650c427ebc0abee68fb245346c742&originationContext=Search%20Result&transitionType=SearchItem&contextData=%28sc.Default%29&VR=3.0&RS=cblt1.0","Court of Appeals of Texas, El Paso.","May 12, 2017","545 S.W.3d 1","","2017 WL 1968019","08-16-00357-CV","LITIGATION - Discovery. Creditors failed to show good cause for entry onto gun shop president's property for inspection of firearms in creditors' action against shop.",
"Cases","","","Texas First Investment Management Co., LLP v. Coorsh","https://www.westlaw.com/Document/I5e89dbe0846011e8a018fb92467ccf77/View/FullText.html?listSource=Search&list=CASE&rank=489&sessionScopeId=0066e1cf23c3ad09864e12e5e17a6d395f5650c427ebc0abee68fb245346c742&originationContext=Search%20Result&transitionType=SearchItem&contextData=%28sc.Default%29&VR=3.0&RS=cblt1.0","Court of Appeals of Texas, Houston (1st Dist.).","July 10, 2018","Not Reported in S.W. Rptr.","","2018 WL 3352922","01-17-00591-CV","Thomas J. Coorsh sued Texas First Investment Management Company, LLP for breach of contract. The trial court granted Coorsh a summary judgment against Texas First Investment, awarding him actual damages and attorneys fees. On appeal, Texas First Investment raises two issues. It contends that Coorsh did not meet his summary-judgment burden to...",
"Cases","","","Fine v. Ecosorb International, Inc.","https://www.westlaw.com/Document/Icaf0990085f411e8a018fb92467ccf77/View/FullText.html?listSource=Search&list=CASE&rank=490&sessionScopeId=0066e1cf23c3ad09864e12e5e17a6d395f5650c427ebc0abee68fb245346c742&originationContext=Search%20Result&transitionType=SearchItem&contextData=%28sc.Default%29&VR=3.0&RS=cblt1.0","Court of Appeals of Texas, Houston (1st Dist.).","July 12, 2018","Not Reported in S.W. Rptr.","","2018 WL 3384556","01-17-00368-CV","Appellant, Harmon K. Fine, is attempting to appeal the trial courts granting of appellee Ecosorb International, Inc. d/b/a Biocel Technologies' application for a post-judgment turnover order. We dismiss the appeal for want of jurisdiction. Biocel sued Fine and his company, Supply Pro, for breach of contract and fraud. After a jury found in...",
"Cases","","","R. Hassell Builders, Inc. v. Texan Floor Service, Ltd.","https://www.westlaw.com/Document/I060214b01d7c11e8bf39ca8c49083d45/View/FullText.html?listSource=Search&list=CASE&rank=491&sessionScopeId=0066e1cf23c3ad09864e12e5e17a6d395f5650c427ebc0abee68fb245346c742&originationContext=Search%20Result&transitionType=SearchItem&contextData=%28sc.Default%29&VR=3.0&RS=cblt1.0","Court of Appeals of Texas, Houston (1st Dist.).","March 01, 2018","546 S.W.3d 816","","2018 WL 1095757","01-17-00027-CV","BANKRUPTCY - Debtor Protections. General contractor was not entitled to the protection of a bankruptcy automatic stay.",
"Cases","","","Sportscapers Construction, Inc. v. Mitchell","https://www.westlaw.com/Document/If0158260967d11e89fc9c0a8a8f09d21/View/FullText.html?listSource=Search&list=CASE&rank=492&sessionScopeId=0066e1cf23c3ad09864e12e5e17a6d395f5650c427ebc0abee68fb245346c742&originationContext=Search%20Result&transitionType=SearchItem&contextData=%28sc.Default%29&VR=3.0&RS=cblt1.0","Court of Appeals of Texas, Houston (1st Dist.).","August 02, 2018","Not Reported in S.W. Rptr.","","2018 WL 3651620","01-17-00432-CV","Appellants, Sportscapers Construction, Inc. and Roderick Thompson (collectively, Sportscapers), challenge the trial courts judgment notwithstanding the verdict (JNOV) in favor of appellees, Evelyn M. Mitchell and Douglas Brown, on Mitchell and Browns breach-of-contract claim against Sportscapers. In its...",
"Cases","Yellow KeyCite","https://www.westlaw.com/Link/RelatedInformation/Flag?docGuid=I8e11f050433811e884b4b523d54ea998&rank=493&listSource=Search&list=CASE&originationContext=Search%20Result&transitionType=SearchItem&contextData=%28sc.Default%29&VR=3.0&RS=cblt1.0","Renda v. Erikson","https://www.westlaw.com/Document/I8e11f050433811e884b4b523d54ea998/View/FullText.html?listSource=Search&list=CASE&rank=493&sessionScopeId=0066e1cf23c3ad09864e12e5e17a6d395f5650c427ebc0abee68fb245346c742&originationContext=Search%20Result&transitionType=SearchItem&contextData=%28sc.Default%29&VR=3.0&RS=cblt1.0","Court of Appeals of Texas, Amarillo.","April 17, 2018","547 S.W.3d 901","","2018 WL 1833523","07-17-00019-CV","LEGAL SERVICES - Malpractice. Genuine fact issues as to whether client released attorney from malpractice claims precluded summary judgment in malpractice action.",
"Cases","","","Norris v. Texas Development Company","https://www.westlaw.com/Document/Id963a5603e6711e8a054a06708233710/View/FullText.html?listSource=Search&list=CASE&rank=494&sessionScopeId=0066e1cf23c3ad09864e12e5e17a6d395f5650c427ebc0abee68fb245346c742&originationContext=Search%20Result&transitionType=SearchItem&contextData=%28sc.Default%29&VR=3.0&RS=cblt1.0","Court of Appeals of Texas, Houston (14th Dist.).","April 12, 2018","547 S.W.3d 656","","2018 WL 1750850","14-16-00802-CV","COMMERCIAL LAW - Guaranty. Guaranty obligation of tenant's owner was not contingent on acceptance and validity of deferred-base-rent agreement between landlord and tenant.",
"Cases","","","Polignone v. Bulldog Chemicals, LLC","https://www.westlaw.com/Document/Ica3e1780ac7811e88c45d187944abdda/View/FullText.html?listSource=Search&list=CASE&rank=495&sessionScopeId=0066e1cf23c3ad09864e12e5e17a6d395f5650c427ebc0abee68fb245346c742&originationContext=Search%20Result&transitionType=SearchItem&contextData=%28sc.Default%29&VR=3.0&RS=cblt1.0","Court of Appeals of Texas, Houston (1st Dist.).","August 30, 2018","Not Reported in S.W. Rptr.","","2018 WL 4128002","01-16-00633-CV","Appellants, Donato Polignone and Neal D. Roy, (collectively, appellants) challenge the trial courts no-answer default judgment in favor of appellee, Bulldog Chemicals, LLC (Bulldog Chemicals), in its suit against them for breach of contract and quantum meruit. In two issues, appellants contend that the...",
"Cases","","","Cypress Creek EMS v. Dolcefino","https://www.westlaw.com/Document/Ib203c3f0375111e8a70fc9d8a0b2aef5/View/FullText.html?listSource=Search&list=CASE&rank=496&sessionScopeId=0066e1cf23c3ad09864e12e5e17a6d395f5650c427ebc0abee68fb245346c742&originationContext=Search%20Result&transitionType=SearchItem&contextData=%28sc.Default%29&VR=3.0&RS=cblt1.0","Court of Appeals of Texas, Houston (1st Dist.).","April 03, 2018","548 S.W.3d 673","","2018 WL 1597463","01–16–00929–CV","TORTS - Conversion. Private investigator did not wrongfully exercise dominion or control over confidential documents he sought that were accidentally mailed to him.",
"Cases","","","Ramirez v. GEICO","https://www.westlaw.com/Document/I8582238041d811e8a70fc9d8a0b2aef5/View/FullText.html?listSource=Search&list=CASE&rank=497&sessionScopeId=0066e1cf23c3ad09864e12e5e17a6d395f5650c427ebc0abee68fb245346c742&originationContext=Search%20Result&transitionType=SearchItem&contextData=%28sc.Default%29&VR=3.0&RS=cblt1.0","Court of Appeals of Texas, El Paso.","April 16, 2018","548 S.W.3d 761","","2018 WL 1790481","08-15-00326-CV","INSURANCE - Bad Faith and Unfair Practices. There was no evidence that automobile insurer purposely delayed in paying insured's medical bills in violation of Deceptive Trade Practices Act claim.",
"Cases","Red KeyCite","https://www.westlaw.com/Link/RelatedInformation/Flag?docGuid=Ife623710dec211e6ac07a76176915fee&rank=498&listSource=Search&list=CASE&originationContext=Search%20Result&transitionType=SearchItem&contextData=%28sc.Default%29&VR=3.0&RS=cblt1.0","Sky View at Las Palmas, LLC v. Mendez","https://www.westlaw.com/Document/Ife623710dec211e6ac07a76176915fee/View/FullText.html?listSource=Search&list=CASE&rank=498&sessionScopeId=0066e1cf23c3ad09864e12e5e17a6d395f5650c427ebc0abee68fb245346c742&originationContext=Search%20Result&transitionType=SearchItem&contextData=%28sc.Default%29&VR=3.0&RS=cblt1.0","Court of Appeals of Texas, Corpus Christi-Edinburg.","January 19, 2017","548 S.W.3d 18","","2017 WL 219122","13–15–00019–CV","COMMERCIAL LAW - Contracts. Developers were not entitled to settlement credit where damages related solely to obligations to pay on loan to private lender in commercial development.",
"Cases","","","ODIN Demolition & Asset Recovery, LLC v. Marathon Petroleum Company, LP","https://www.westlaw.com/Document/I0886d130ac7e11e8943bb2cb5f7224e8/View/FullText.html?listSource=Search&list=CASE&rank=499&sessionScopeId=0066e1cf23c3ad09864e12e5e17a6d395f5650c427ebc0abee68fb245346c742&originationContext=Search%20Result&transitionType=SearchItem&contextData=%28sc.Default%29&VR=3.0&RS=cblt1.0","Court of Appeals of Texas, Houston (1st Dist.).","August 30, 2018","Not Reported in S.W. Rptr.","","2018 WL 4131038","01-17-00438-CV","Appellant, ODIN Demolition & Asset Recovery, LLC (ODIN), challenges the trial court's take-nothing judgment, entered after a jury trial, in favor of appellee, Marathon Petroleum Company, LP (Marathon), in ODIN's suit against Marathon for negligence, tortious interference with a contract, breach of contract, and fraud. In...",
"Cases","","","Long Island Pipe, Inc. v. QT Trading, LP","https://www.westlaw.com/Document/I127b44d0846211e88d669565240b92b2/View/FullText.html?listSource=Search&list=CASE&rank=500&sessionScopeId=0066e1cf23c3ad09864e12e5e17a6d395f5650c427ebc0abee68fb245346c742&originationContext=Search%20Result&transitionType=SearchItem&contextData=%28sc.Default%29&VR=3.0&RS=cblt1.0","Court of Appeals of Texas, Houston (1st Dist.).","July 10, 2018","Not Reported in S.W. Rptr.","","2018 WL 3353015","01-18-00012-CV","In this interlocutory appeal from the trial courts order overruling a special appearance in a suit for breach of contract, see Tex. Civ. Prac. & Rem. Code §51.014(a)(7), the principal issue is whether the nonresident defendant consented to personal jurisdiction in Texas. A New York corporation, Long Island Pipe, Inc., ordered...",
"Cases","","","Baylor Scott & White v. Peyton","https://www.westlaw.com/Document/I18bbfa1043ee11e884b4b523d54ea998/View/FullText.html?listSource=Search&list=CASE&rank=501&sessionScopeId=0066e1cf23c3ad09864e12e5e17a6d395f5650c427ebc0abee68fb245346c742&originationContext=Search%20Result&transitionType=SearchItem&contextData=%28sc.Default%29&VR=3.0&RS=cblt1.0","Court of Appeals of Texas, Fort Worth.","April 19, 2018","549 S.W.3d 242","","2018 WL 1865803","02-17-00135-CV","GOVERNMENT - Immunity. Hospital district management contractor was not a manager of a hospital under governmental immunity statute, and thus was not entitled to immunity.",
"Cases","Yellow KeyCite","https://www.westlaw.com/Link/RelatedInformation/Flag?docGuid=Ia8e06c20440711e8a054a06708233710&rank=502&listSource=Search&list=CASE&originationContext=Search%20Result&transitionType=SearchItem&contextData=%28sc.Default%29&VR=3.0&RS=cblt1.0","Lona Hills Ranch, LLC v. Creative Oil & Gas Operating, LLC","https://www.westlaw.com/Document/Ia8e06c20440711e8a054a06708233710/View/FullText.html?listSource=Search&list=CASE&rank=502&sessionScopeId=0066e1cf23c3ad09864e12e5e17a6d395f5650c427ebc0abee68fb245346c742&originationContext=Search%20Result&transitionType=SearchItem&contextData=%28sc.Default%29&VR=3.0&RS=cblt1.0","Court of Appeals of Texas, Austin.","April 19, 2018","549 S.W.3d 839","","2018 WL 1868054","03-17-00743-CV","ENERGY AND UTILITIES - SLAPP Suits. Operator's breach-of-contract counterclaim was factually predicated on lessor's exercise of the right to petition.",
"Cases","","","Taylor Housing Authority v. Shorts","https://www.westlaw.com/Document/Ib52130e0497611e8a054a06708233710/View/FullText.html?listSource=Search&list=CASE&rank=503&sessionScopeId=0066e1cf23c3ad09864e12e5e17a6d395f5650c427ebc0abee68fb245346c742&originationContext=Search%20Result&transitionType=SearchItem&contextData=%28sc.Default%29&VR=3.0&RS=cblt1.0","Court of Appeals of Texas, Austin.","April 26, 2018","549 S.W.3d 865","","2018 WL 1955550","03-16-00274-CV, 03-16-00276-CV","REAL PROPERTY - Subsidized Housing. Municipal housing authority was entitled to governmental immunity against claims seeking conveyance of title to public housing projects.",
"Cases","","","Cochran Investments, Inc. v. Chicago Title Insurance Company","https://www.westlaw.com/Document/Iae4d80006ff711e8a5b89e7029628dd3/View/FullText.html?listSource=Search&list=CASE&rank=504&sessionScopeId=0066e1cf23c3ad09864e12e5e17a6d395f5650c427ebc0abee68fb245346c742&originationContext=Search%20Result&transitionType=SearchItem&contextData=%28sc.Default%29&VR=3.0&RS=cblt1.0","Court of Appeals of Texas, Houston (14th Dist.).","June 14, 2018","550 S.W.3d 196","","2018 WL 2994776","14–16–00119–CV","REAL PROPERTY - Covenants and Restrictions. Special warranty deed did not include an implied covenant of seisin.",
"Cases","","","Housing Authority of City of El Paso v. Beltran Electrical Contractors, Inc.","https://www.westlaw.com/Document/I5f76338018fb11e8baa7f50ab2e5f065/View/FullText.html?listSource=Search&list=CASE&rank=505&sessionScopeId=0066e1cf23c3ad09864e12e5e17a6d395f5650c427ebc0abee68fb245346c742&originationContext=Search%20Result&transitionType=SearchItem&contextData=%28sc.Default%29&VR=3.0&RS=cblt1.0","Court of Appeals of Texas, El Paso.","February 23, 2018","550 S.W.3d 707","","2018 WL 1026452","08–16–00043–CV","LITIGATION - Experts. Trial court's error, if any, in striking plaintiff's expert's causation opinion, was not reversible error.",
"Cases","Yellow KeyCite","https://www.westlaw.com/Link/RelatedInformation/Flag?docGuid=I05acfaa043ee11e884b4b523d54ea998&rank=506&listSource=Search&list=CASE&originationContext=Search%20Result&transitionType=SearchItem&contextData=%28sc.Default%29&VR=3.0&RS=cblt1.0","Robinson v. Home Owners Management Enterprises, Inc.","https://www.westlaw.com/Document/I05acfaa043ee11e884b4b523d54ea998/View/FullText.html?listSource=Search&list=CASE&rank=506&sessionScopeId=0066e1cf23c3ad09864e12e5e17a6d395f5650c427ebc0abee68fb245346c742&originationContext=Search%20Result&transitionType=SearchItem&contextData=%28sc.Default%29&VR=3.0&RS=cblt1.0","Court of Appeals of Texas, Fort Worth.","April 19, 2018","549 S.W.3d 226","","2018 WL 1865799","02-16-00380-CV","REAL PROPERTY - Contractors and Developers. Availability of class-action arbitration under arbitration agreement in a new home limited warranty was a gateway substantive issue for the court.",
"Cases","","","In re Allstate Insurance Company","https://www.westlaw.com/Document/I2efd94d0380611e8a70fc9d8a0b2aef5/View/FullText.html?listSource=Search&list=CASE&rank=507&sessionScopeId=0066e1cf23c3ad09864e12e5e17a6d395f5650c427ebc0abee68fb245346c742&originationContext=Search%20Result&transitionType=SearchItem&contextData=%28sc.Default%29&VR=3.0&RS=cblt1.0","Court of Appeals of Texas, San Antonio.","April 04, 2018","551 S.W.3d 798","","2018 WL 1610927","04-18-00060-CV","INSURANCE - Property. Discovery request for all hailstorm claims within five-mile radius on same day was not reasonably calculated to lead to the discovery of admissible evidence.",
"Cases","","","Truyen Luong v. McAllister","https://www.westlaw.com/Document/I2b41fe60967711e89b71ea0c471daf33/View/FullText.html?listSource=Search&list=CASE&rank=508&sessionScopeId=0066e1cf23c3ad09864e12e5e17a6d395f5650c427ebc0abee68fb245346c742&originationContext=Search%20Result&transitionType=SearchItem&contextData=%28sc.Default%29&VR=3.0&RS=cblt1.0","Court of Appeals of Texas, Houston (1st Dist.).","August 02, 2018","Not Reported in S.W. Rptr.","","2018 WL 3651103","01-17-00198-CV","Appellant, Truyen Luong, challenges the trial courts rendition of summary judgment in favor of appellees Robert A. McAllister, Jr. and Robert A. McAllister, Jr. and Associates, P.C. (collectively, McAllister), in his suit against them for breach of contract, quantum meruit, and unjust enrichment. In three issues, Luong contends...",
